Date,ticker,Impact
2024-03-03,1302.SR,"Shareholders who meet the eligibility criteria can expect to receive cash dividends from Bawan Co. for the second half of 2023. To facilitate seamless dividend disbursement, stakeholders are advised to update their personal information and link their bank accounts to their investment portfolios."
2024-03-03,2020.SR, The extension of the MoU between SABIC Agri-Nutrients Company and SALIC demonstrates both parties' commitment to further exploring opportunities for food security and environmental sustainability. This extension does not have any material financial impact on the company.
2024-03-03,4100.SR," The establishment of the Investment Committee by Makkah Construction and Development Company demonstrates a commitment to strategic planning and decision-making in regards to investments. The committee's formation is expected to enhance the company's ability to evaluate potential investment opportunities and make informed decisions, contributing to the overall growth and success of the organization."
2024-03-03,9523.SR,The addition of a new audit committee member to Group Five Pipe Saudi Co. demonstrates the company's commitment to maintaining strong corporate governance practices. This appointment will contribute to the oversight of the company's financial reporting and internal control processes.
2024-03-03,9523.SR,"The announcement impacts shareholders and stakeholders of Group Five Pipe Saudi Co., who should refer to the Arabic version for specific meeting details. The high attendance rate indicates strong shareholder engagement, potentially influencing future company decisions."
2024-03-03,NBMFF," This announcement is primarily informational, providing details about NBM's General Assembly meeting. Investors and stakeholders interested in the bank's governance and decision-making processes should refer to the Arabic version for comprehensive insights."
2024-03-04,8260.SR, The approval of the Domestic Workers Contract Insurance product allows Gulf General Cooperative Insurance Company to extend its product offerings in the Kingdom of Saudi Arabia. This move is expected to bolster the company's presence in the region and cater to the needs of individuals employing domestic workers.
2024-03-04,8200.SR,The sale of Saudi Re's stake in Probitas Holdings (Bermuda) Limited will have a positive impact on the company's financials in 2024. The transaction proceeds will enable Saudi Re to strengthen its financial position and capitalize on growth opportunities in its core markets.
2024-03-04,4263.SR,"The positive financial results highlight SAL's success in increasing revenues and controlling costs. The growth in net profit and total comprehensive income demonstrates the company's financial strength. Investors may view these results favorably, potentially leading to increased interest in the company's shares."
2024-03-04,4263.SR,"The declaration of cash dividends by SAL Saudi Logistics Services Co. signifies a positive outcome for its shareholders, providing them with a 15.1% return on share par value. This move is expected to strengthen investor confidence and contribute to the company's reputation as a profitable investment."
2024-03-04,ANB180.NZ," Shareholders are encouraged to participate in the Extraordinary General Assembly Meeting to discuss the agenda topics, ask questions, and exercise their voting rights. The electronic voting process allows shareholders to engage conveniently, regardless of their location. The outcome of this meeting could significantly impact the bank's future direction and shareholder value."
2024-03-04,1545.T,"The CMA's approval of ""Alkhabeer Diversified Income Traded Fund 2030"" allows the fund to be listed on the Saudi Stock Exchange (Tadawul) as a Close-ended Traded Fund. Potential investors should carefully review the T&Cs to fully understand the fund's strategy, objectives, and risk factors before making an investment decision. The CMA's approval serves as a confirmation that the fund has met the necessary legal requirements, but it does not imply a recommendation to invest in the fund."
2024-03-04,1545.T,"The CMA's approval of ""Alkhabeer Diversified Income Traded Fund 2030"" allows the fund to be listed on the Saudi Stock Exchange (Tadawul), providing investors with additional investment opportunities. However, investors must conduct thorough due diligence and carefully weigh the associated risks before deciding to invest in the fund."
2024-03-04,1120.SR,"The decision by Al Rajhi Bank to issue U.S. Dollar-denominated sustainable Sukuk reflects its commitment to sustainable finance and its strategic objectives. The offering, once approved, will provide eligible investors with the opportunity to participate in a Shariah-compliant investment instrument, potentially attracting a diverse range of investors and contributing to the growth of the global Sukuk market."
2024-03-04,4071.SR," The amended contract between Al Arabia and Remat Al-Riyadh Development Company signifies a strategic shift in their partnership, with Al Arabia transferring a portion of the investment returns as owned shares to Remat Al-Riyadh Development Company. This adjustment may impact Al Arabia's financials and shareholding structure, while simultaneously fostering stronger ties between the two companies and contributing to the Kingdom's economic growth in line with Vision 2030."
2024-03-05,HCC-H.V," The virtual Ordinary General Assembly Meeting allows shareholders to participate, discuss, and vote on important matters concerning Hail Cement Co. from any location, ensuring safety and convenience. This meeting format encourages broader shareholder engagement and facilitates decision-making processes for the company's future."
2024-03-05,AZMCF,"The share buyback proposal by Saudi AZM for Communication and Information Technology Co. aims to allocate treasury shares to employees, potentially strengthening employee engagement and loyalty. The acquisition will be funded internally, and the company must fulfill financial solvency requirements as per the Companies Law. The purchased shares will not have voting rights, ensuring existing shareholders' control remains unchanged."
2024-03-05,9631.SR,"This announcement enables shareholders of Al Khaleej Training and Education Company to participate in the decision-making process of the Extraordinary General Assembly meeting remotely and conveniently. By voting electronically, shareholders can exercise their rights effectively, contributing to the company's governance and strategic direction."
2024-03-05,4330.SR,This earnings conference call allows Riyadh Cables Group Co. to strengthen its relationship with the financial community by providing transparent and detailed information about its 2023 financial performance. It offers an opportunity for investors and analysts to gain insights into the company's operations and ask questions directly to the management.
2024-03-05,2222.SR," The decision to sell off Turkish investments indicates Saudi Cable Company's strategic shift to focus on more profitable opportunities. This move may lead to improved financial performance for the company in the long run, but could also result in short-term financial implications due to potential divestment costs."
2024-03-05,1140.SR,"Bank Albilad's capital increase is expected to strengthen its financial position and enable the bank to pursue new business opportunities. Shareholders will benefit from the distribution of bonus shares, which could potentially lower the share price and attract more investors, contributing to increased trading volume and liquidity."
2024-03-05,1140.SR,"Bank Albilad's capital increase, authorized by the Capital Market Authority, will result in a stronger financial position for the bank. The distribution of bonus shares to existing shareholders will dilute their equity but potentially attract new investors, contributing to the growth of the bank's outstanding shares. Shareholders must remain vigilant to ensure compliance with the bank's due dates and regulatory requirements."
2024-03-05,1120.SR,"This announcement signifies Al Rajhi Bank's entry into the international Sukuk market, aiming to raise capital through its sustainable Sukuk offering. The move is expected to attract eligible investors seeking Shariah-compliant investments and contribute to the growth of sustainable finance."
2024-03-05,2200.SR,"The impressive financial performance of Arabian Pipes Co. in 2023 reflects the company's successful execution of its business strategies and operational efficiency. The substantial growth in sales, profits, and shareholders' equity is expected to attract investor interest and potentially lead to an increased market capitalization."
2024-03-06,4162.SR,"This acquisition marks a significant milestone for Almunajem Foods Co., expanding their portfolio and strengthening their presence in the poultry sector. The transaction, valued at SAR 134 million, highlights the company's commitment to strategic investments and growth."
2024-03-06,NBMFF,No impact assessment available due to lack of English translation.
2024-03-06,MO,"The formation of the ""New Rest Catering Services Company"" represents a strategic alliance between Abdulmohsen Alhokair Group and Newrest Company, aiming to deliver specialized services to airline, contracting, and project clients. This partnership is expected to strengthen both companies' positions in the Saudi Arabian market and enhance their offerings in the catering and facilities management sectors."
2024-03-06,6070.SR,"The declaration of dividends by Al-Jouf Agricultural Development Co. will result in shareholders receiving a 5% return on their investment, based on the par value of their shares. This move is anticipated to positively impact shareholders and potentially attract new investors, contributing to the company's market standing."
2024-03-06,4021.SR,"The new headquarters in Jubail city will enable Canadian Medical Center Co. to strengthen its presence in the region and cater to the needs of the local population by offering home healthcare services. The contract represents a strategic move to enhance the company's operations and expand its footprint, ultimately contributing to its financial performance in the latter half of 2024."
2024-03-06,1120.SR,The successful completion of Al Rajhi Bank's U.S. dollar-denominated sustainable Sukuk offering demonstrates the bank's commitment to sustainable finance and its ability to tap into the international Islamic capital market. This move is expected to attract a diverse range of global investors and further strengthen Al Rajhi Bank's position in the industry.
2024-03-06,2222.SR," The reported financial results reflect a challenging year for Saudi Electricity Company, with a substantial decline in net profit despite an increase in sales/revenue. Investors should closely monitor the company's efforts to address rising costs and maintain profitability. The company's forthcoming conference call with investors and financial analysts will provide further insight into the financial performance and strategies moving forward."
2024-03-06,2222.SR,"Shareholders of Saudi Electricity Company can expect cash dividends for fiscal year 2023, subject to certain tax implications for non-resident foreign investors. Shareholders should ensure their banking information is up-to-date to facilitate dividend payments."
2024-03-06,1182.SR,"The proposed capital increase by Amlak Finance is expected to strengthen the company's financial position and support its expansion plans. Shareholders will benefit from the bonus issue, receiving one additional share for every eight shares owned. The success of the capital increase relies on the approval of regulatory authorities and the extraordinary general assembly. Upon approval, the transaction is likely to positively impact Amlak Finance's market presence and investor confidence."
2024-03-06,2370.SR," The positive financial performance of Middle East Specialized Cables Co. indicates a healthy financial position, with improvements in sales, profits, and equity. Investors may find these results encouraging, potentially attracting increased interest in the company's shares. However, the reclassification of some comparative figures from the previous year may require careful analysis when comparing performance."
2024-03-07,BA,"The formation of the Audit Committee demonstrates Theeb Rent a Car Co.'s commitment to maintaining strong corporate governance practices. The committee members' extensive backgrounds in finance, investments, internal audit, and risk management will contribute significantly to the company's financial oversight and strategic decision-making."
2024-03-07,BA,"Theeb Rent A Car's continuous growth in Saudi Arabia highlights its commitment to serving a broader clientele and solidifying its presence in strategic locations. The new branch in Jeddah is expected to improve accessibility and convenience for customers seeking car rental services in the area, further strengthening the company's reputation and market position."
2024-03-07,AZMCF,"The project win represents a significant revenue contribution for Saudi AZM for Communications and Information Technology Co. in 2024. This collaboration with the National Center for Government Resources Systems highlights the company's expertise in supporting national and commercial systems, further solidifying its presence in the communications and IT sector."
2024-03-07,4330.SR,"Shareholders registered with Edaa by the specified date will receive a dividend of SAR 1.50 per share, making the total dividends for the year 2023 SAR 2.50 per share. This announcement is likely to positively impact shareholders and influence the company's stock price."
2024-03-07,4190.SR,"The announcement of dividend distribution by Jarir Marketing Co. will likely positively impact its investors, who will receive a 23% return on share par value. To benefit from this dividend, shareholders must ensure they meet the eligibility criteria set by the company."
2024-03-07,4146.SR," Shareholders with eligible shares stand to benefit from a 0.3 SAR dividend per share, reflecting a 30% return on share par value. Further details regarding the distribution date will be communicated later. Shareholders are encouraged to contact the company's investor relations department for additional information."
2024-03-07,3020.SR,"The launch of the new Yamama Cement Factory demonstrates the company's commitment to enhancing its capabilities in the cement sector and realizing its vision of becoming a leader in the industry, both locally and internationally. The factory's significant production capacity and advanced technology are expected to contribute to the local economy, in line with the Kingdom's Vision 2030, while providing high-quality cement products to the market."
2024-03-07,2223.SR,"The transfer of shares to PIF's fully owned companies does not impact Saudi Aramco's operations, strategy, dividends distribution policy, or governance framework. The State remains the largest shareholder, ensuring business continuity and maintaining the Company's strategic direction."
2024-03-07,1213.SR, The call for nominations allows eligible individuals to participate in the governance of Naseej International Trading Co. as Board members. Successful candidates will contribute to shaping the company's strategic direction and overseeing its operations. This process supports the company's commitment to maintaining sound corporate governance practices and ensures shareholder representation in decision-making.
2024-03-07,4146.SR,"Investors are likely to view these strong financial results positively, as they indicate improved operational performance and increased profitability. The robust growth in sales, net profit, and comprehensive income highlights Gas Arabian Services Co.'s ability to capitalize on market opportunities and manage its business effectively. The unmodified auditor's opinion adds credibility to the financial statements, instilling confidence in the company's financial health."
2024-03-10,9587.SR,The launch of Lana Medical Company's high-risk medical waste treatment plant in Hail signifies a significant expansion in the company's capacity to manage medical waste in the region. This development will contribute to improved health and environmental standards in the Hail region and the north of the Kingdom. Investors can anticipate positive financial impacts from the second quarter of 2024 onwards.
2024-03-10,IDCC,"The call for nominations offers shareholders the opportunity to contribute to SIDC's governance by joining the Board of Directors. Successful candidates will have the chance to participate in decision-making processes and help guide the company's strategic direction. Interested shareholders should ensure they meet the eligibility criteria and submit their applications, together with all required documents, before the deadline."
2024-03-10,GIG-SDB.ST,The approval of the amendments to GIG's Articles of Association and expansion of its purpose indicates the company's commitment to adapting to new corporate regulations and diversifying its services. This move is expected to strengthen GIG's position in the market and cater to a broader range of customer needs.
2024-03-10,EGS3C0O1C016.CA,"The reported decline in financial performance may impact Arabian Cement Co.'s market position and investor confidence. However, the unmodified opinion from the external auditor indicates that the financial statements are accurate and fair. Investors should closely monitor the company's performance and strategies to address the challenges faced."
2024-03-10,EGS3C0O1C016.CA,"The proposed dividend distribution indicates a positive financial performance by Arabian Cement Co. in the second half of 2023. Shareholders meeting the eligibility criteria can expect a 0.75 SAR dividend per share, subject to General Assembly approval. This announcement may positively infl uence the company's stock price and attract potential investors."
2024-03-10,8060.SR,"The submission of the rights issue application to the CMA indicates that Walaa Cooperative Insurance Co. is moving forward with its plans to raise additional capital. This move could potentially strengthen the company's financial position and enable it to pursue new business opportunities. However, the success of the rights issue will depend on the market's response and the overall economic conditions."
2024-03-10,AZMCF,This correction announcement does not contain any significant impact on the company or its stakeholders. It is merely a rectification of the previously announced date of receiving the award notice.
2024-03-10,4150.SR,"ARDCO's decision to distribute cash dividends and special dividends is a positive development for shareholders, who will benefit from a 5% return on share par value. The additional special dividend highlights the company's focus on rewarding shareholders while maintaining sustainable growth."
2024-03-10,4146.SR,"The decision of the substantial shareholders to sell a portion of their shares will impact the ownership structure of GAS Arabian Services Co. This development is a significant step towards fulfilling the liquidity requirement for transitioning to the main market. The change in ownership might influence the company's market position and investor relations. However, the specifics of the transaction, such as the identity of the investors and the exact percentage of shares being sold, remain undisclosed in the announcement."
2024-03-10,2223.SR," The 2023 financial results of Saudi Aramco indicate a challenging year for the company due to lower crude oil prices and reduced sales volumes. Despite the decline, Saudi Aramco managed to maintain a significant operational profit and net profit, demonstrating resilience in the face of market challenges. Investors should closely monitor the company's performance and strategies to adapt to evolving market conditions."
2024-03-10,2223.SR,"Saudi Aramco's decision to increase the Q4 2023 base dividend and distribute performance-linked dividends based on the combined 2022-2023 full-year results demonstrates the company's commitment to delivering value to its shareholders. The total distribution of SAR 116.50 billion ($31.07 billion) among 241,957,485,588 shares will positively impact shareholders, offering them a return on their investment."
2024-03-10,2223.SR,"The approval of the third distribution of performance-linked dividends by Saudi Aramco's Board of Directors demonstrates the company's commitment to rewarding shareholders. The substantial dividend amount highlights the company's strong financial performance and cash flow generation capabilities. Investors may benefit from the distribution, which could potentially boost their returns and confidence in the company."
2024-03-10,6070.SR,"The election of the new board members will bring fresh perspectives and ideas to Al-Jouf Agricultural Development Co., potentially leading to improved corporate performance and better alignment with the company's long-term objectives. Shareholders and stakeholders should anticipate updates regarding the new board's strategic direction and initiatives in the coming months."
2024-03-11,NBMFF,"Without access to the Arabic version, the specific impact of this financing agreement cannot be determined. The lack of information in the English version makes it challenging to assess the significance of this event for NBM, its stakeholders, or investors."
2024-03-11,NBMFF,The announcement does not provide suf cient information in English to assess the impact of the financing on NBM or its stakeholders.
2024-03-11,9530.SR,"The appointment of these three new Board Members brings diverse expertise and experience to Arabian Shield Cooperative Insurance Co. Once approved by the relevant authorities, they will contribute to the decision-making process and help guide the company's strategic direction."
2024-03-11,9530.SR,The publication of Arabian Drilling's Q4'23 and FY2023 financial results and the subsequent earnings call will provide transparency into the company's performance and create an opportunity for investors and analysts to gain insights directly from the management team.
2024-03-11,2283.SR,"The positive financial results of First Milling Co. indicate a strong performance in 2023, with increased sales/revenue and net profit compared to the previous year. The growth in sales was primarily driven by the flour, feed, and bran segments, while net profit benefited from higher value and volume sales, cost control measures, and reduced general and administrative expenses. These results suggest a favorable outlook for the company and potential opportunities for investors."
2024-03-11,2160.SR,"The announcement indicates a strong demand for Amiantit's shares, with 91.71% coverage of the new offering. The remaining shares will be available for institutional investors to purchase, potentially increasing their exposure to the company. This may positively affect the company's market capitalization and share price."
2024-03-11,1303.SR," The robust financial performance of Electrical Industries Co. indicates a positive trend for the company, potentially attracting more investors and contributing to the growth of the Saudi Arabian market. The improved financials may lead to increased confidence in the company's ability to manage its operations and expand its market presence."
2024-03-11,1080.SR," The CMA's approval of Arab National Bank's capital increase will bolster the bank's financial position and enable it to pursue growth opportunities. Shareholders will benefit from the distribution of bonus shares, while potential investors may view the bank as a more attractive investment opportunity due to its stronger capital base."
2024-03-11,1080.SR,"The CMA's approval of Arab National Bank's capital increase will result in a stronger financial position for the bank, enabling it to pursue new business opportunities and investments. Existing shareholders will benefit from the increased capital through the distribution of bonus shares, potentially enhancing their holdings and portfolio value."
2024-03-11,2283.SR, The distribution of cash dividends for the second half of 2023 will provide shareholders with a return on their investment. Non-resident foreign investors should be mindful of the potential 5% withholding tax. Shareholders are advised to ensure their data and bank account information are up-to-date to guarantee seamless dividend disbursement.
2024-03-12,1201.SR," The successful completion of Takween Advanced Industries Co.'s rump offering and rights issue allotment demonstrates strong investor confidence in the company. The oversubscription indicates a positive market response, while the distribution of excess proceeds will benefit eligible shareholders. The company's receipt of the offer price will support its financial position and future operations."
2024-03-12,1303.SR," Shareholders of Electrical Industries Co. can expect to receive cash dividends for the second half of 2023, provided they meet the eligibility criteria. Foreign investors need to consider potential tax implications. This dividend distribution demonstrates the company's commitment to rewarding its shareholders and enhancing their investment returns."
2024-03-12,2283.SR,"This virtual earnings conference call allows First Milling Company to share its 2023 financial results directly with financial analysts and investors, fostering transparency and engagement with the investment community."
