Date,ticker,Impact
2024-04-03,1545.T,"The CMA's approval of Yaqeen S&P ESG MENA ETF on Tadawul offers investors a new opportunity to participate in the ETF market, focusing on Environmental, Social, and Governance (ESG) factors within the MENA region. However, investors must conduct thorough research and carefully weigh the associated risks before making investment decisions. Consulting a financial advisor is recommended if needed."
2024-04-03,4280.SR, The approved amendments to the bylaws and the increase in board members aim to ensure compliance with the new Companies Law and enhance the company's governance structure. These changes will contribute to improved decision-making processes and better alignment with industry best practices.
2024-04-03,8311.SR,The renewal of the health insurance license ensures that Saudi Enaya Cooperative Insurance Co. can maintain its operations and continue providing health insurance services to its clients. This move demonstrates the company's commitment to adhering to regulatory requirements and its dedication to offering reliable health insurance solutions in the Saudi market.
2024-04-03,AZMCF,"The successful acquisition of this project by Saudi Azm for Communications and Information Technology Co. indicates a positive growth trajectory for the company. The project's signifi cant value highlights the organization's expertise in data management and governance, potentially leading to increased revenue and market share."
2024-04-03,EICCF," This announcement encourages shareholders to actively participate in the Electrical Industries Company's decision-making process by attending and voting in the Extraordinary General Assembly meeting. Shareholders can voice their opinions, ask questions, and exercise their voting rights remotely, promoting accessibility and inclusivity."
2024-04-03,SUKOONTAKAFL.AE,"This announcement does not have a direct financial impact on Al Rajhi Takaful. Instead, it serves to inform shareholders and potential Board of Directors candidates about the updated nomination process and requirements."
2024-04-04,SUKOONTAKAFL.AE,This development affects eligible shareholders of Al Rajhi Takaful who owned fractional shares following the company's capital increase. These shareholders have now received the proceeds from the sale of their fractional shares in their linked bank accounts. The process enables Al Rajhi Takaful to efficiently manage fractional shares while ensuring that shareholders receive their rightful dues.
2024-04-04,PLUG," The virtual Extraordinary General Assembly Meeting enables shareholders to actively engage in the decision-making process, regardless of their location. By providing remote access to discussions, question submissions, and electronic voting, ACWA POWER encourages shareholder participation and transparency, ultimately contributing to informed decision-making and the company's continued growth."
2024-04-04,9587.SR,"This contract win marks a significant milestone for Lana Company, as they expand their presence in the environmental management sector. The Ministry of Interior's decision to partner with Lana Company demonstrates trust in their capabilities to handle hazardous medical waste. This project will not only contribute to the cleanliness and safety of health centers affiliated with the Security Forces Hospital but also generate financial returns for Lana Company."
2024-04-04,9530.SR," The ongoing discussions between Arabian Drilling and Aramco may result in temporary disruptions to the former's offshore operations. However, the company's revenue guidance for 2024 remains unchanged, and it continues to expect yearly growth. The addition of Unconventional Gas land rigs in Q3 2024 should further contribute to this growth, potentially offsetting the impact of the offshore contract suspensions."
2024-04-04,7010.SR,"stc shareholders are encouraged to participate in the Ordinary General Assembly meeting using the Tadawulaty Platform. This virtual format enables shareholders to engage in discussions, ask questions, and exercise their voting rights electronically, promoting accessibility and convenience."
2024-04-04,3005.SR," This extension allows Umm Al-Qura Cement Co. and City Cement Co. more time to evaluate the potential securities exchange deal. The decision to extend the MoU indicates a commitment to thoroughly assessing the deal's implications, ensuring a more informed final decision. Investors should monitor for further updates regarding the progress of the negotiations and the outcome of the evaluations."
2024-04-04,2382.SR," The temporary suspension of five offshore jack-ups in Saudi Arabia allows ADES to capitalize on higher daily rates in new contracts in Thailand and the region. The company's strong financial guidance and robust marketing strategy for the remaining rigs position ADES well to benefit from the tight market conditions and elevated utilization rates, reinforcing its standing as a leading player in the global offshore jack-up market."
2024-04-04,2100.SR,"The addition of Mr. Majid Misfer Al-Ghufaili to Wafrah for Industry and Development Co.'s Board of Directors is expected to contribute valuable expertise and insights from his extensive background in Saudi industrial companies. However, his appointment is provisional and awaits approval from the first General Assembly of shareholders."
2024-04-04,2020.SR," The meeting offers shareholders an opportunity to participate in discussions, ask questions, and vote on the General Assembly Meetings agenda remotely. The electronic voting process ensures convenience and accessibility for shareholders, while the live audio broadcast allows those unable to attend to stay informed."
2024-04-04,1050.SR,"BSFR's share buyback is intended for employee compensation purposes and is not expected to significantly affect the bank's overall financial health or stock price. The transaction will increase the bank's treasury shares, potentially limiting the number of shares available for trading. However, the absence of voting rights associated with the purchased shares is unlikely to influence the governance structure of the bank."
2024-04-04,7010.SR,"The announcement con rms the eligibility and distribution date for stc's special cash dividends, allowing shareholders to prepare for timely registration and ensuring their bank account details are up-to-date. Foreign non-resident investors should factor in the 5% withholding tax when considering their dividend proceeds."
2024-04-23,2283.SR,"First Milling Co.'s positive Q1 2024 financial results indicate a successful strategy of capacity expansion, product innovation, and cost management. The company's flour and feed categories experienced significant growth, resulting in increased profitability. With a net profit margin of 28% and a wheat milling capacity utilization of 91%, First Milling Co. demonstrates its commitment to sustainable and profitable growth."
2024-04-23,2300.SR," Shareholders are encouraged to participate in the Extraordinary General Assembly meeting to discuss and vote on important matters affecting the companys operations and future direction. Key decisions, such as increasing the companys capital, distributing dividends, and amending bylaws, will significantly impact shareholders and the overall performance of the Saudi Paper Manufacturing Co."
2024-04-23,4082.SR, The approval of the financial statements and auditor's report by the shareholders ensures transparency and accountability in MRNA's financial operations. The appointment of Ernst & Young as the auditor for the fiscal year 2024 will maintain the company's financial integrity. The amendment of the social responsibility policy and approval of the Conflict-of-Interest Policy and Business Ethics demonstrate MRNA's commitment to upholding ethical standards and corporate social responsibility.
2024-04-23,MO,"These changes reflect Al Hokair Group's commitment to maintaining strong corporate governance practices. The new appointments and committee formations will enable the organization to better address regulatory requirements and ensure transparency, accountability, and efficient decision-making."
2024-04-23,SIIGF,"Shareholders can participate in the decision-making process by attending the EGM and exercising their voting rights on the proposed agenda items. This meeting offers shareholders the opportunity to engage with the company's management, discuss the 2023 financial performance, and elect new board members for the upcoming term. By actively participating in the EGM, shareholders can contribute to shaping SIIG's future and ensuring its continued success."
2024-04-24,PLUG," The electronic voting process allows ACWA Power Co. shareholders to conveniently participate and vote in the Extraordinary General Assembly Meeting, regardless of their geographical location. This remote participation method promotes inclusivity and accessibility for all shareholders, ensuring their voices are heard in the decision-making process related to the company's capital increase."
2024-04-24,MO,"No financial impact is associated with these appointments. The revised Audit Committee is expected to contribute to the Group's governance and financial oversight, leveraging the appointees' extensive expertise in auditing, finance, and banking."
2024-04-24,4330.SR,"The approval of the financial statements, auditor's report, and dividend distribution reflect positively on Riyadh Cement Co.'s financial health and commitment to shareholder returns. The appointment of PWC as the auditor ensures continued adherence to financial reporting standards. Related-party transaction approvals demonstrate transparency and compliance with regulations. The authorization for interim dividends allows for potential additional returns to shareholders throughout the fiscal year 2024."
2024-04-24,1150.SR,The approval of Alinma Bank's capital increase via bonus shares and the subsequent adjustment of fluctuation limits will affect the bank's share price and trader strategies. Investors should be prepared for the changes in the market dynamics and potential shifts in the stock's volatility.
2024-04-24,1150.SR,These adjustments to Alinma Bank's SSO and SSF contracts will affect current and potential investors by altering the terms of their existing and future positions. Investors should review the updated contract specifications and consider how these changes may impact their investment strategies.
2024-04-24,1050.SR,"This announcement encourages shareholders to engage in the decision-making process of Banque Saudi Fransi by participating in the Extraordinary General Assembly Meeting. By providing an online registration and voting system, the bank aims to facilitate shareholder involvement and ensure a quorum for the meeting."
2024-04-24,4150.SR,"The approval of the financial statements, appointment of the auditor, and discharge of directors' liabilities mark important steps in Arriyadh Development Co.'s corporate governance. The distribution of dividends and authorization for interim dividends will benefit the shareholders, while the appointment of a new board member ensures the continuity of the company's operations."
2024-04-25,1050.SR,"BSFR's positive Q1 2024 financial performance reflects improved income from special commissions and reduced total operating expenses. The growth in net profit, clients' deposits, and assets indicate a healthy financial standing for the bank, which could attract more investors and contribute to the expansion of its operations."
2024-04-25,3092.SR," Shareholders who meet the eligibility criteria will receive cash dividends for the second half of 2023, directly transferred to their linked bank accounts. Shareholders are advised to update their data and ensure bank account linkage to facilitate dividend deposit. Non-resident foreign investors should take note of the 5% withholding tax on cash dividends."
2024-04-25,BA,"Theeb Rent a Car Co.'s strategic expansion in Riyadh demonstrates its commitment to serving diverse regions and solidifying its footprint in key cities across Saudi Arabia. This move is expected to enhance the company's accessibility and offer a wider range of car rental options for customers in the capital. Theeb Rent a Car's continued growth bolsters its position as a prominent and experienced leader in the car rental sector, both locally and internationally."
2024-04-28,1010.SR," The positive Q1 2024 financial performance of Riyad Bank indicates a solid start to the year, with improvements in net profit, total comprehensive income, assets, and liabilities. These results demonstrate the bank's resilience and ability to navigate the economic landscape, potentially attracting investors seeking stable returns."
2024-04-28,2160.SR," The strong Q1 2024 financial performance of Saudi Arabian Amiantit Co. highlights the success of their strategic initiatives and debt management. Investors will likely appreciate the improved profitability and positive outlook, potentially boosting the company's share price and attracting further investment."
2024-04-28,3005.SR, The positive Q1 2024 financial results of Umm Al-Qura Cement Co. indicate a robust performance driven by increased sales and reduced expenses. This trend is likely to instill confidence in investors and contribute to the company's market reputation. The continued growth trajectory may lead to increased market share and attract further investment in the near future.
2024-04-28,4162.SR,The establishment of this new food factory is expected to strengthen Almunajem Foods Co.'s position in the market and contribute to the local economy in Jeddah. The project's successful completion and subsequent positive impact on the company's financial results could potentially attract additional investments and boost the company's growth.
2024-04-28,ANB180.NZ," Shareholders of Arab National Bank are encouraged to participate in the EGAM to discuss and vote on the proposed capital increase. Electronic registration and voting simplify the process, allowing shareholders to engage from any location. The outcome of this meeting could potentially influence the bank's future growth and financial stability."
2024-04-29,OXLC,"SNB Capital's role in SMASCO's IPO highlights its expertise in managing and executing complex financial transactions. The IPO is expected to enhance SMASCO's visibility and access to capital, providing opportunities for growth and expansion. Investors interested in SMASCO's offerings can find more information on the Capital Market Authority website (www.cma.org.sa) and the Company website (www.smasco.com)."
2024-04-29,MCW,"Shareholders can participate in the decision-making process of Al-Moammar Information Systems Co. by attending the General Assembly Meeting, reviewing the company's performance, and voting on the proposed agenda items. This opportunity allows shareholders to contribute to the company's governance and financial direction, ultimately influencing its growth and success."
2024-04-29,EICCF,"The announcement of the Extraordinary General Assembly meeting results marks an important step in EIC's corporate governance. The high attendance rate demonstrates strong shareholder engagement, while the presence of Board members and Committee Chairmen underlines the company's commitment to transparency and accountability. Investors should stay informed about the voting outcomes on the agenda items, as they may have implications for EIC's future strategy and financial performance."
2024-04-29,EGS3C0O1C016.CA, The approval of interim dividends and the distribution of SAR 150 million for FY 2023 will benefit shareholders directly. The cement procurement authorization with RMCC in Jordan may lead to potential business opportunities for the company. The granting of authority to the Board for one year allows for more efficient decision-making and management of company affairs.
2024-04-29,1120.SR,"Al Rajhi Bank's Q1 2024 financial results demonstrate a positive trend in net profit growth, driven by increased total operating income and net financing and investment income. Despite a slight decline in total comprehensive income, the bank's financial health remains robust, with growth in assets, investments, loans, and clients' deposits. This performance reinforces the bank's position in the Saudi Arabian market."
2024-04-29,1180.SR,"SNB's Q1 2024 financial results demonstrate a modest growth in net profit, driven by increased operating revenue and non-operating income. Despite the positive net profit figure, the decline in total comprehensive income raises concerns about the bank's asset quality. Nevertheless, the bank's growing assets and customer deposits indicate a healthy expansion in its core business."
2024-04-29,1140.SR,"Bank Albilad's strong Q1 2024 performance, marked by increased profits and assets, demonstrates resilience and growth in its operations. The bank's focus on improving net income from investing and financing assets, along with better management of expected credit losses, has contributed to the positive results. Investors may find these developments encouraging, potentially leading to increased confidence in the bank's financial stability and prospects."
2024-04-29,1214.SR,"This addendum serves to provide additional context and transparency for shareholders ahead of the extraordinary general assembly meeting. The capital increase process remains unchanged, with the distribution of one new share for every 6.637685 existing shares following the capitalization of 72,666,000 Saudi Riyals from the statutory reserve account."
2024-04-30,3005.SR,"The outcome of the Extraordinary General Assembly Meeting is not explicitly stated in the announcement. However, the meeting was conducted according to schedule, with the required quorum achieved in the second session. This event highlights the company's commitment to maintaining transparency and engaging with its shareholders through digital platforms."
2024-04-30,8200.SR,"The conference call facilitated open communication between Saudi Re and its investors and financial analysts, allowing them to discuss the company's financial performance in detail. By providing the earnings presentation on its website, Saudi Re continues to demonstrate its dedication to transparency and accessibility of information."
2024-04-30,4162.SR,"This acquisition will expand Almunajem Foods Co.'s portfolio and influence within the poultry sector, while providing an opportunity for growth and diversification. The transaction's success hinges on obtaining necessary approvals and clearances. Investors should monitor the company's announcements regarding any material developments concerning the transaction."
2024-04-30,2081.SR,"This 15-year contract will generate financial impact for Alkhorayef Water and Power Technologies Co. starting in Q3 2024. The agreement demonstrates the company's commitment to providing essential water and power services in Saudi Arabia, contributing to the nation's infrastructure development."
2024-04-30,BLDI.TA, The share sale is expected to impact Baladi Poultry Trading Company's financial results once the necessary approvals are obtained and the transaction is executed. Further updates regarding the transaction will be disclosed in accordance with relevant regulations and instructions.
2024-04-30,1301.SR,"The outcomes of the Extraordinary General Assembly Meeting will impact United Wire Factories Co.'s financial management, auditing process, and dividend distribution for the fiscal year 2024. Shareholders can now access detailed information about these changes and inquire further through the provided contact channels."
2024-04-30,1140.SR,"This move by the Saudi Exchange aims to maintain market stability and fairness following Bank Albilad's capital increase. Investors should be aware of the new share price and adjust their strategies accordingly. Additionally, those who had existing orders for Bank Albilad shares will need to place new orders at the revised price."
2024-04-30,1140.SR,The approval of the capital increase will enhance Bank Albilad's financial solvency and resource retention for operational activities. The decision to delegate the Board of Directors to distribute interim dividends on a semi-annual or quarterly basis for the fiscal year 2024 will provide shareholders with more frequent dividend distributions. The amendments to the Articles of Association will align the bank's governance structure with the new companies law and improve overall corporate governance.
2024-04-30,2020.SR,"The announcement of the General Assembly's Meeting results allows shareholders to stay informed about the company's decision-making process. The high attendance rate indicates strong engagement from the shareholder community. However, the absence of one Board member might raise questions about the board's unity or potential internal issues. Overall, the meeting's outcome supports SABIC's transparency and commitment to keeping stakeholders informed."
2024-05-05,EGS3C0O1C016.CA,"Investors should note the resilient performance of Arabian Cement Co. despite challenging market conditions. The increase in net profit, driven by improved pricing strategies and lower finance costs, demonstrates the company's ability to adapt to market fluctuations. The slight decrease in revenue and sales volume can be attributed to the Ramadan month overlap, which may not be indicative of long-term trends."
2024-05-05,8050.SR,"This approval allows SALAMA Cooperative Insurance Company to expand its product offerings in the Saudi Arabian market, providing accident and marine liability coverage for both individuals and groups. This move is expected to strengthen the company's presence in the region and cater to a broader customer base."
2024-05-05,3123.T,"SAIB's Q1 2024 financial results reflect a positive trend in net profit, driven by increased total operating income. However, a slight increase in net impairment charges and a minor decrease in total comprehensive income should be noted. Overall, the bank's performance indicates stability and growth in the Saudi Arabian financial sector."
2024-05-05,4270.SR," The approval of the financial statements, board report, and external auditor report for the fiscal year ending on December 31, 2023, highlights SPPC's transparency and commitment to regulatory compliance. The appointment of Ernst & Young as the external auditor ensures continued adherence to financial reporting standards. The discharge of the board members indicates confidence in their stewardship. Lastly, the approval of transactions and contracts with the Saudi Research and Media Group, despite indirect interests from board members, demonstrates SPPC's ability to manage conflicts of interest while maintaining business relationships."
2024-05-05,1321.SR,This contract will bolster East Pipes' presence in the industry and contribute to their financial performance in the second half of the 2024-2025 financial year. Investors can anticipate a positive impact on East Pipes' financial standing due to this agreement.
2024-05-05,1050.SR,"This announcement affects shareholders of Banque Saudi Fransi, who are encouraged to attend the Q1-2024 earnings call to stay informed about the bank's financial performance. Registered shareholders should ensure they receive the SMS instructions to participate in the call."
2024-05-05,2120.SR," Saudi German Health's Q1 2024 financial results indicate a positive trend in revenues and net profits driven by increased patient numbers and utilization of outpatient clinics. Despite the QoQ decline in sales revenue due to seasonal factors, the overall performance remains robust. Investors should keep an eye on the ongoing discussions with the Zakat, Tax and Customs Authority (ZATCA) regarding additional tax liabilities, as this may impact future financial statements."
2024-05-06,UCA1.HM," The fire incident at United Ink Production Co. Ltd.'s factory is not expected to have a substantial financial impact on UCA, thanks to its reinsurance arrangements. The company's proactive response in appointing a loss adjustor and commitment to transparency demonstrate its resilience and dedication to addressing the situation effectively."
2024-05-06,SUKOONTAKAFL.AE,"The strong Q1 2024 financial performance of Al-Rajhi Company for Cooperative Insurance indicates a positive trend for the company, with significant growth in net profit and gross written premiums. The improvements in net insurance service results and total investment income demonstrate the company's ability to capitalize on business growth and increased investible assets. Despite a slight decline in total comprehensive income, the overall financial health of the company remains robust, offering a promising outlook for shareholders and investors."
2024-05-06,GIG-SDB.ST,"Shareholders are encouraged to participate in the Ordinary General Assembly Meeting to discuss and vote on important matters affecting Gulf Insurance Group, such as approving financial statements, appointing auditors, and determining dividends. Eligible shareholders can vote online via the Tadawulaty platform. The outcome of the meeting may significantly impact the company's financial performance and governance."
2024-05-06,AZMCF,"The project win represents a substantial growth opportunity for AZM, significantly contributing to its financial performance. This collaboration will likely enhance AZM's reputation in the market and potentially attract further business opportunities in the government resources systems sector."
2024-05-06,ASO,"The proposed 50% capital increase will bolster Academy of Learning's financial standing, enabling it to pursue strategic growth objectives. Shareholders stand to benefit from the distribution of bonus shares, potentially enhancing their holdings and participation in the company's success."
