Date,ticker,Impact
2024-03-12,4081.SR," Investors should be aware of the decline in net profit despite an increase in sales/revenue. Higher finance costs and impairment charges impacted the bottom line. Nevertheless, the increase in total comprehensive income and shareholders' equity may be seen as positive indicators for the company's financial health."
2024-03-12,9566.SR,"The renewed credit facilities agreement demonstrates Saudi Lime Industries Company's strong relationship with Arab National Bank and its commitment to Sharia compliance. This financing will enable the company to pursue strategic growth initiatives, ultimately contributing to its long-term success and financial stability."
2024-03-13,PLUG," The successful completion of the Taweelah RO Desalination Plant represents a significant milestone for ACWA Power, demonstrating their ability to deliver large-scale, complex projects. This achievement will likely contribute to the company's financial performance and solidify its position as a key player in the global power generation and water desalination market."
2024-03-13,9631.SR,The approval of the transfer of the entire statutory reserve to the retained earnings demonstrates Al Khaleej Training and Education Company's commitment to efficient financial management. This decision is expected to positively influence the company's financial stability and future growth prospects.
2024-03-13,9568.SR,The successful acquisition of this sizeable contract by Mayar Holding Company's subsidiary will generate substantial revenue over the 24-month implementation period. This development is likely to bolster the company's financial standing and solidify its position in the market.
2024-03-13,9602.SR," The successful conclusion of Almohafaza's offering at 18 SAR per share and the substantial coverage indicate strong investor interest in the education sector. This development will potentially boost Almohafaza's growth and expansion plans, while offering investors the opportunity to participate in the company's success."
2024-03-13,8060.SR,"Walaa Cooperative Insurance Co.'s strong financial performance in 2023 highlights the company's successful growth strategy and improved operational efficiency. The increased net profit and revenue will likely boost investor confidence and contribute to the company's market standing. However, the rise in operating expenses requires careful monitoring to ensure sustainable growth."
2024-03-13,4082.SR," The financial results show a positive trend in revenue growth, but declines in profitability metrics. Despite the increase in sales, the decrease in net profit and comprehensive income may raise concerns for some investors. However, the substantial rise in total shareholders' equity could be viewed as a positive sign. Overall, the unmodified auditor's opinion supports the credibility of the financial statements."
2024-03-13,2110.SR,"Shareholders of Saudi Cable Company are encouraged to participate in the Ordinary General Assembly meeting to exercise their voting rights on the election of board members and the policy of nominating board members and executive management. The meeting offers shareholders the convenience of attending in-person or via modern technology, providing an opportunity for remote participation and voting."
2024-03-13,9557.SR,The contract between EDARAT and NCM will contribute positively to EDARAT's financial performance in 2024 and 2025. The company will benefit from the revenue generated by providing and supporting the Meteomatics weather analysis system for the National Center For Meteorology.
2024-03-14,8170.SR,"Al-Etihad Cooperative Insurance Co.'s strong financial performance in 2023 reflects an improved insurance business and investment strategy. The growth in revenues and net profit will likely boost investor confidence and contribute to the company's market reputation. The adoption of IFRS 17 and IFRS 9 has resulted in a significant change in the presentation of financial results, providing a more accurate representation of the company's financial health."
2024-03-14,3050.SR,"The proposed cash dividend distribution is expected to benefit SPCC shareholders with a 0.65 SAR return per share. The total distribution of 91,000,000 SAR will be shared among 140,000,000 eligible shares. Non-resident investors should be aware of the 5% withholding tax on cash dividends. Shareholders are encouraged to update their data with their respective banks to ensure timely receipt of their dividends."
2024-03-14,BA,"The distribution of Q4 2023 cash dividends by Theeb Rent a Car Company will benefit eligible shareholders, providing them with a return on their investment. To receive dividends, shareholders must ensure they meet the eligibility criteria and have updated their information with the Saudi Securities Depository Center Company (Edaa)."
2024-03-14,2222.SR," The substantial decline in Saudi Top for Trading Co.'s financial results might raise concerns among investors, potentially affecting the company's stock price and market reputation. The company will need to address these challenges and implement strategies to improve profitability and restore investor confidence."
2024-03-14,2020.SR,"The appointment of Mr. Fahad Misfer Al-Battar as CEO of SABIC Agri-Nutrients Company signifies a strategic move in the company's leadership. With his extensive experience and strong background in the petrochemicals and Agri-Nutrients sector, the new CEO is expected to lead the company towards further growth and success."
2024-03-14,2300.SR," The strong financial performance of Saudi Paper Manufacturing Co. indicates improved operational efficiency and market expansion. The positive results may attract investor interest, potentially leading to increased share prices and market capitalization."
2024-03-24,2081.SR,"Alkhorayef Water and Power Technologies holds a 50% stake in the consortium responsible for the IWTP project, which is anticipated to significantly contribute to the drinking water supply in the Makkah and Madinah regions. The successful financial closing of the project marks a crucial milestone, highlighting the company's commitment to investing in essential infrastructure and advancing the water transmission capabilities in the Kingdom of Saudi Arabia."
2024-03-24,4002.SR,The positive financial performance of Mouwasat Medical Services Co. indicates a healthy growth trend in the company's operations. The double-digit percentage increase in both sales revenue and net profit is expected to attract investor attention and contribute to the company's market standing. This financial success can potentially lead to increased investments and further expansion of Mouwasat's healthcare services.
2024-03-24,NBMFF,The announcement does not provide sufficient information in English to assess the potential impact of the NBM Board's decision on distribution.
2024-03-24,NBMFF," The overall financial performance of NBM has shown improvement, with increased sales, gross profit, and operational profit. However, the decrease in net profit and comprehensive income may be a concern for some investors. Nevertheless, the growth in total shareholders' equity could be perceived as a positive sign of the bank's financial stability."
2024-03-25,9543.SR," The positive 2023 financial results of Saudi Networkers Services Co. demonstrate strong growth and financial stability. The continued revenue growth and increased net profit are likely to attract investor interest, potentially leading to increased market capitalization and shareholder value. The unmodified auditor's opinion further instills confidence in the company's financial reporting."
2024-03-25,MCW,"The agreement between MIS and EXPRO will enable the efficient supply of Microsoft products and services to government entities, potentially leading to improved operational efficiencies and cost savings. The financial implications of this partnership will manifest in the second quarter of 2024."
2024-03-25,9631.SR,"By choosing not to distribute cash dividends for FY2023, Al Khaleej Training and Education Company aims to strengthen its financial position and facilitate growth through strategic acquisitions and expansions in the education sector. This decision may impact shareholder returns but is expected to contribute to the company's long-term success."
2024-03-25,9557.SR,"Shareholders' participation in this meeting is crucial for decision-making on important matters such as the proposed capital increase, auditor's report, and board member rewards. By engaging in the voting process, shareholders can help shape the future direction of the company and ensure their interests are represented. The electronic voting system allows shareholders to conveniently exercise their rights and influence EDARAT's development."
2024-03-25,9543.SR,"Shareholders of Saudi Networkers Services Co. can expect cash dividends for the second half of 2023, subject to approval by the General Assembly. Non-resident investors should be aware of the 5.0% withholding tax on dividends. Timely updating of shareholder information and bank account linkage will ensure efficient dividend disbursement."
2024-03-25,1010.SR,The announcement of the ordinary General Assembly Meeting results confirms Riyad Bank's commitment to transparency and engaging with its shareholders. The strong attendance rate indicates investor interest in the bank's operations and future plans. The meeting's outcomes will likely in uence shareholder decisions and contribute to the bank's strategic direction.
2024-03-25,8311.SR,"These appointments and formations reflect Saudi Enaya Cooperative Insurance Co.'s commitment to adhering to regulatory requirements and maintaining a strong governance structure. The new leadership and subcommittees will contribute to the company's strategic direction and decision-making processes, ultimately benefiting stakeholders and the overall performance of the organization."
2024-03-25,4100.SR," Shareholders of Makkah Construction and Development Co. can expect to receive cash dividends for the fiscal year 2023, pending approval from the general assembly and regulatory authorities. The dividend per share amounts to 1.5%, representing a 15% return on the share par value. Shareholders are advised to update their bank information to facilitate the direct deposit of dividends into their accounts."
2024-03-25,1321.SR,"This contract marks a significant milestone for East Pipes, as they expand their operations in the manufacturing and supply of steel pipes to Saline Water Conversion Corporation. The agreement will have a positive financial impact on East Pipes for multiple years, commencing in the 1st quarter of the financial year 2024/2025."
2024-03-25,9523.SR,"This contract is expected to contribute significantly to Group Five Pipe Saudi Co.'s financial performance, with the infl uence becoming apparent in the third quarter of the fiscal year 2024. The company's involvement in the Ras Al-Khair water transportation system project demonstrates its commitment to delivering high-quality piping solutions for essential infrastructure projects, further solidifying its position in the market."
2024-03-26,4021.SR,"Shareholders benefitting from this dividend distribution must meet the eligibility criteria, which includes owning shares on the specified date and being registered in the Securities Depository Center Company. The automatic dividend deposit aims to streamline the process for shareholders while ensuring timely receipt of their profits. Foreign investors should factor in the 5% withholding tax when anticipating their dividends."
2024-03-26,ANB180.NZ,"The proposed share buy-back is expected to strengthen the bank's employee incentive program, potentially enhancing employee motivation and attracting skilled professionals. The transaction will be subject to shareholder approval and the bank's adherence to solvency conditions. Once completed, the shares will be held as treasury stocks without voting rights."
2024-03-26,9590.SR,"Armah Sports Co.'s impressive financial performance, marked by a 507% surge in revenue and a return to profitability, reflects the company's successful expansion and service enhancement strategies. This positive trend is expected to continue, given the company's ability to manage operational and financial challenges effectively."
2024-03-26,4280.SR,"The announcement of cash dividends for the fiscal year 2023 by Kingdom Holding Co. is expected to positively affect shareholder value. Shareholders who meet the eligibility criteria will receive a dividend of SAR 0.28 per share, contributing to a 2.8% return on the share par value. Investors are encouraged to stay updated on the eligibility and distribution dates, as well as ensure their banking information is current to facilitate dividend deposits."
2024-03-26,3020.SR, The approval of dividends and the re-election of the Board of Directors' members will likely maintain investor confidence in the company. The approval of transactions and contracts with related parties will enable Yamama Cement Company to continue its operations and maintain relationships with various stakeholders.
2024-03-26,6070.SR,"The formation of the new Audit Committee demonstrates Al-Jouf Agricultural Development Company's commitment to maintaining strong internal controls and financial transparency. The committee members' extensive experience in accounting, finance, and business administration will contribute significantly to the company's financial oversight and governance. Investors may view this development as a positive step towards ensuring the company's financial stability and integrity. "
2024-03-26,1303.SR,"This contract marks a significant milestone for Electrical Industries Co. and its subsidiary, Saudi Power Transformers Co., as it extends their presence in the Saudi Arabian market and strengthens their relationship with Larsen &Toubro Saudi Arabia. The 20-month contract, valued at over SAR 125 million, is expected to positively impact the company's financial results in 2026. This development highlights the company's expertise in providing transformer solutions for large-scale energy projects, such as Aramco's Jafoura Gas Project."
2024-03-26,1150.SR,"The CMA's approval of Alinma Bank's capital increase will lead to a stronger financial position for the bank, enabling it to pursue new business opportunities and boost shareholder value. The distribution of bonus shares will likely result in increased shareholding and potentially higher investor confidence in the bank."
2024-03-26,1150.SR,"The CMA's approval of Alinma Bank's capital increase is expected to bolster the bank's financial position and enable it to pursue new business opportunities. Shareholders will benefit from the distribution of bonus shares, while potential investors may view this move as a positive signal, possibly attracting increased interest in the bank's shares."
2024-03-26,2282.SR,"The declaration of dividends by Naqi Water Co. indicates a positive financial performance for the second half of 2023. Eligible shareholders can expect to receive a 0.50 SAR dividend per share, subject to meeting the eligibility criteria. This announcement may in uence the company's stock price and attract potential investors, contributing to the overall growth of the company."
2024-03-26,1201.SR, This loan repayment move by Takween Advanced Industries demonstrates a proactive financial management strategy to counteract the effects of rising interest rates. The improved financial indicators resulting from this repayment may strengthen the company's financial position and potentially attract more investors seeking stable fi nancial performance.
2024-03-26,1301.SR,"The approval of this recommendation by the General Assembly would result in an increase in the company's retained earnings, potentially strengthening its financial position and providing greater flexibility in managing its financial resources."
2024-03-27,1833.SR,Shareholders benefiting from this dividend distribution are those who own shares in Al Mawarid Manpower Company before the specified eligibility date. Foreign investors need to consider potential tax implications. The company's focus on accurate data and communication with shareholders aims to facilitate efficient dividend transfers.
2024-03-27,1833.SR,"Al Mawarid Manpower Co.'s strong financial performance in 2023 demonstrates the company's ability to capitalize on market opportunities and manage costs effectively. The positive results may attract investor interest and contribute to the company's market reputation. However, investors should also consider potential risks and challenges that could impact future financial performance."
2024-03-27,2382.SR," This agreement signifies ADES' commitment to expanding its operations in Egypt and contributing to the country's oil production growth. The $66 million investment over three years is expected to generate substantial returns for ADES, given its entitlement to incremental production based on a mutually agreed formula."
2024-03-27,3020.SR,"The successful acquisition of funding by Yamama Cement Company from Alinma Bank demonstrates the company's strong financial position and its commitment to maintaining prudent financial management practices. The diversified financing structure allows Yamama Cement Company to optimize its liabilities, invest in infrastructure projects, and manage day-to-day operations effectively. This strategic move is expected to strengthen the company's competitiveness in the cement market and contribute to its sustained growth."
2024-03-27,4071.SR,"This contract win signifies a significant expansion for Arabian Contracting Services Co.'s subsidiary, Faden Media Company, in the outdoor advertising market in Riyadh City. Investors can expect potential revenue growth for Arabian Contracting Services Co. over the next 10 years due to this project, contributing to the company's financial performance and market presence."
2024-03-27,4090.SR,"Taiba Investments Co.'s strong sales/revenue growth and solid comprehensive income reflect a positive financial performance, while the decline in net profit suggests a short-term impact from acquisition-related costs and legal provisions. Overall, the company's financial health appears robust, offering potential reassurance to investors."
2024-03-27,ANB180.NZ,"The successful conclusion of the Extraordinary General Assembly Meeting demonstrates the bank's commitment to engaging shareholders and adopting modern technology for efficient communication. The meeting's outcomes will be determined by the attached voting results, which will guide the bank's future direction."
2024-03-27,ASII.JK,The announcement of dividend distribution by Astra Industrial Group (AIG) will positively affect shareholders who meet the eligibility criteria. Foreign investors should be aware of the 5% withholding tax on cash dividends.
2024-03-28,SUKOONTAKAFL.AE,"Al Rajhi Takaful's clarification aims to inform investors and shareholders about the lawsuit's outcome and the company's financial measures. Although the dispute concerns a substantial amount, Al Rajhi Takaful has taken adequate precautions and deems the matter immaterial. Investors and shareholders should continue to monitor the situation for any updates or additional developments."
2024-03-28,HCC-H.V,"The announcement of the auditor fees has no financial impact on HCC or its stakeholders. This information is provided for transparency and disclosure purposes, ensuring stakeholders are well-informed about the company's financial reporting processes."
2024-03-28,HCC-H.V," The approval of all agenda items signifies HCC's commitment to maintaining transparency and sound financial practices. The authorization of interim dividends will likely be welcomed by shareholders, while the allocation for social responsibility highlights the company's dedication to community involvement."
2024-03-28,AZMCF,"This contract represents a significant milestone for Saudi Azm for Communication and Information Technology Co., as it not only strengthens their presence in the market but also ensures a positive financial impact on the company's financial results for the years 2024-2025. Investors can anticipate a stronger financial performance from the company due to this agreement."
2024-03-28,9568.SR,"Mayar Holding Co.'s 2023 financial results reflect substantial decreases in sales, gross profit, and net income. The company's accumulated losses and extraordinary expenses have raised concerns among investors. However, the Board's strategic plans to improve profitability and cash flows, modernize production, and reduce costs may help reverse the negative trend in the medium and long term."
2024-03-28,2100.SR," The positive financial results demonstrate Wafrah for Industry and Development Co.'s strong performance in 2023. The increased revenues, gross profit, and net profit indicate a healthy financial position, which may attract investor interest. However, the decrease in operational profit should be noted. The company's reliance on the vegetable and pasta sectors for growth may also present some risk if these sectors experience a downturn. Overall, the results suggest that the company is expanding its customer base and increasing sales power, contributing to its financial success."
2024-03-28,4141.SR,"Investors should be aware of the decrease in gross profit and net income, despite the growth in sales. However, the increase in total shareholders' equity could be seen as a positive sign. It is essential to consider the reasons behind the decline in profits and the potential for recovery in future periods."
2024-03-28,4021.SR,"The lease agreement does not have a direct financial impact on the company. The Chairman, Mr. Khalid bin Mohammed Al Ammar, holds an indirect interest in this contract as the Chairman of Khayrat Amariya Real Estate Company. The contract will be disclosed to the next General Assembly."
2024-03-28,1302.SR,"The awarded contracts signify a positive growth opportunity for Bawan Company's electric sector subsidiary, as they secure a substantial revenue stream for the 2024-2025 period. Investors can expect to see the infl uence of these contracts in Bawan's Q4 2024 to Q4 2025 financial statements."
2024-03-28,9535.SR," Ladun Investment Co.'s robust financial performance indicates a positive outlook for the company and its shareholders. The substantial growth in sales, profits, and shareholder equity highlights the success of their real estate projects and overall business strategy. Investors may consider these positive results as a reason to maintain or increase their exposure to Ladun Investment Co."
2024-04-02,4020.SR,"This contract marks a significant milestone for Al-Akaria, as it continues to expand its infrastructure projects portfolio. The 722 million Saudi Riyals contract will contribute to Al-Akaria's financial statements starting from Q1 2024, showcasing the company's strong financial performance and commitment to delivering high-value projects. The involvement of the Public Investment Fund further highlights the importance of this project for Saudi Arabia's infrastructure development."
2024-04-02,9535.SR, The successful acquisition of this project by Ladun Investment Co.'s subsidiary indicates a strong presence in the construction sector and contributes to the company's financial growth in the coming years.
2024-04-02,3123.T," SAIB shareholders are encouraged to participate in the Extraordinary General Assembly meeting to discuss the proposed increase of the Bank's capital. Eligible shareholders can vote remotely using the Tadawulaty system, ensuring a seamless and efficient process. The live broadcast and real-time communication channels allow shareholders to stay informed and engaged throughout the meeting."
2024-04-02,4020.SR,"This contract marks a significant milestone for Al-Akaria, as it continues to develop the Tilal Al Riyadh project. By engaging its subsidiary, Tamear, Al-Akaria ensures continuity and control over the project's execution. The 22-month contract duration allows for steady progress, while the financial impact will become evident in Q2 2024, contributing to Al-Akaria's financial performance."
2024-04-02,4007.SR,"Al Hammadi Holding's sale of its land in Riyadh City marks a strategic move to support the company's future expansion plans. The transaction is anticipated to yield a capital gain of 55,269,000 SAR, improving the company's financial standing and contributing to its growth initiatives."
2024-04-02,2120.SR,"The delayed release of the 2023 annual financial results is not expected to have a direct financial impact on the company or its stakeholders. However, the extension may cause temporary uncertainties in the market. Once the financial results are released, investors and stakeholders will gain clarity on the company's performance, enabling them to make informed decisions."
2024-04-02,1140.SR,"Shareholders' participation in the Extraordinary General Assembly Meeting is crucial for decision-making regarding the Bank's financial performance, capital structure, dividends, and governance. By attending the meeting, shareholders can exercise their voting rights, engage in discussions, and contribute to shaping the Bank's future direction."
2024-04-02,3020.SR,"These appointments and committee formations are expected to strengthen Yamama Cement Company's corporate governance, ensuring compliance with regulatory requirements and enhancing transparency. The new leadership and committee members bring diverse expertise and experience to their roles, which should contribute to the company's strategic decision-making and overall performance."
