Date,ticker,Impact
2024-05-13,2382.SR,"The impressive financial results of ADES Holding Co. for Q1 2024 indicate a positive trend for the company. The strong revenue growth and margin enhancements have led to a significant increase in net profit, demonstrating the company's ability to effectively manage its operations and finances. The growth in revenue and net profit is expected to positively impact ADES's market position and investor confidence."
2024-05-13,2283.SR,"The share buy-back is not anticipated to have a significant financial impact on First Milling Company's financial results. This move supports the company's efforts to motivate and retain key employees, ultimately contributing to the achievement of its strategic goals."
2024-05-13,8170.SR,"Al-Etihad Cooperative Insurance Co.'s Q1 2024 financials indicate a challenging quarter, with a significant decline in net profit and total comprehensive income. The company's earnings per share also decreased considerably compared to the same period last year. However, the increase in insurance revenues and gross written premiums demonstrates some positive developments in core business operations."
2024-05-14,IDCC,"SIDC's Q1 2024 financial results reveal a decline in net profit and an increase in accumulated losses, which may cast doubt on the company's ability to continue its operations. Investors should closely monitor the company's progress and its ability to address these challenges. The audit report highlights the need for successful business plan execution to ensure sufficient cash flows and maintain operations."
2024-05-14,UCA1.HM,"This announcement allows shareholders of the United Cooperative Assurance Company to participate in the Ordinary General Assembly Meeting remotely, promoting inclusivity and accessibility. By utilizing the Tadawulaty platform, shareholders can discuss the agenda, ask questions, and exercise their voting rights, contributing to informed decision-making and good corporate governance."
2024-05-14,IMMOU.BR,"The collaboration between SCA and UBF is expected to strengthen the UAE's financial sector, enhance its regulatory and legislative environment, and improve the investment appeal. By working together, the two entities aim to create a more coherent financial landscape, achieve the UAE Vision 2071, and enhance the country's economic competitiveness and business environment, ultimately solidifying the UAE's status as an international hub for financial innovation."
2024-05-14,9631.SR,"The meeting offers shareholders the opportunity to engage in discussions, ask questions, and vote on important matters affecting the company. Shareholders' participation is crucial in determining the future direction of Al Khaleej Training and Education Company."
2024-05-14,IMMOU.BR,"This training course aims to enhance the participants' understanding of the legal aspects governing the securities sector. Although the specifics of the course remain undisclosed due to the language barrier, the collaboration between SCA and Dubai Economic Security demonstrates a shared commitment to strengthening the legal framework and expertise in the Emirate of Dubai."
2024-05-14,9543.SR,The change in audit committee membership may affect the company's financial oversight and reporting processes. Investors should monitor the company's announcements regarding any potential impacts on financial reporting and regulatory compliance.
2024-05-14,4090.SR," Taiba Investments Co.'s strong Q1 financial performance indicates a positive outlook for the company, driven by the acquisition of Dur Hospitality Co. and growth in the hospitality sector. The robust results could potentially attract investor interest and contribute to the company's market reputation. However, investors should consider the sustainability of this growth in the upcoming quarters."
2024-05-14,9543.SR,The resignation of Mr. Asher Noor Nisar Akhtar from the Board of Directors of Saudi Networkers Services Co. will result in a change in the composition of the board. The company will need to identify and appoint a suitable replacement to maintain the board's effectiveness and ensure continuity in decision-making processes.
2024-05-14,4003.SR,"The formation of the Audit Committee at eXtra demonstrates the company's commitment to maintaining robust corporate governance practices. The committee members' extensive backgrounds in governance, finance, and auditing will contribute significantly to the company's financial oversight and strategic decision-making."
2024-05-14,1210.SR,"BCI's Q1 2024 financials demonstrate a positive trend in revenue growth and a significant improvement in net profit. These results reflect the company's ability to effectively manage costs and optimize operations, ultimately delivering enhanced value to shareholders. Investors may view these financials as a sign of BCI's strong commitment to operational excellence and financial discipline."
2024-05-15,EICCF,"The Saudi Power Transformers Co. Factory expansion is expected to have a positive impact on EIC's financial results starting in Q4 2027. The project's commercial production will contribute to the company's growth and diversification, demonstrating EIC's commitment to innovation and localization in the electrical products industry, in line with Saudi Arabia's Vision 2030."
2024-05-15,BLDI.TA,"The SAR 81 million contract between Balady Poultry and BAADER FOOD Systems Denmark will contribute to enhancing the company's production capabilities and promoting food security in Saudi Arabia. This investment is expected to create new job opportunities and strengthen the poultry industry, ultimately benefiting the nation's overall economic development."
2024-05-15,BA," The announcement invites shareholders of Theeb Rent a Car Co. to participate in the Ordinary General Assembly Meeting, where they can discuss the agenda topics, ask questions, and exercise their voting rights remotely. This meeting is a chance for shareholders to engage with the company's management and contribute to decision-making processes."
2024-05-15,4146.SR,The announcement of the Extraordinary General Assembly Meeting results signifies a significant milestone for GAS Arabian Services Co. The robust attendance rate demonstrates shareholder engagement and commitment to the company's governance. The voting outcomes on the agenda items will shape the company's future direction and initiatives. Investors should stay informed about these decisions as they may impact the company's performance and share value.
2024-05-15,4100.SR, The positive Q1-2024 financial results of Makkah Construction and Development Co. indicate strong performance and growth potential. The improvements in revenue and net profit are likely to attract investor interest and contribute to the company's market standing.
2024-05-15,4051.SR," The non-convening of the Extraordinary General Assembly Meetings does not affect the company's financials, external auditor work, or capital structure. The company will continue to operate as usual until the third extraordinary general assembly meeting is held, where decisions will be made based on the board of directors' recommendations."
2024-05-15,2200.SR,"The Ordinary General Assembly meeting of Arabian Pipes Company has concluded, providing shareholders with updates on the company's performance and future plans. The outcomes of the meeting, including voting results on various agenda items, are documented and available for review."
2024-05-15,2100.SR,"Wafrah for Industry and Development Co.'s strong Q1 2024 financial performance highlights the success of its sales expansion strategies and the vegetable sector's contribution. Investors will likely view this positively, potentially driving up the share price and attracting further investment. However, it is essential to monitor the company's ability to maintain this growth throughout the year and address any potential challenges in managing increased expenses."
2024-05-15,1833.SR,"Al Mawarid Manpower Co.'s Q1 2024 financial performance shows a positive trend, with substantial growth in sales/revenue and net profit. This improvement indicates a healthy financial position and increased investor confidence. The company's focus on expanding its workforce and enhancing revenue generation has contributed to the overall growth, making it an attractive investment opportunity."
2024-05-15,1831.SR," Maharah Human Resources Co.'s positive Q1 2024 financial performance reflects the company's strategic focus on core sectors, associates, and subsidiaries. The growth in revenue and net profit indicates improving market conditions and the company's ability to capitalize on opportunities. Investors should closely monitor Maharah's continued progress and performance."
2024-05-15,1301.SR,"Investors should take note of the declining revenue and profits compared to the same period last year, but also acknowledge the improvement in net profit and total comprehensive income compared to the previous quarter. The fluctuations in sales volume and zakat expenses have affected the company's financial performance, and stakeholders should monitor these factors moving forward."
2024-05-15,2222.SR,"Shareholders of Saudi Electricity Company have approved the distribution of dividends, marking a significant financial event for the company and its investors. The approval of the Board's recommendations and the discharge of their liabilities demonstrate the company's commitment to transparency and accountability. The event highlights the company's strong financial performance and its intention to reward shareholders, potentially attracting new investors and bolstering market confidence."
2024-05-16,4051.SR," Baazeem Trading Co.'s Q1 2024 financial results indicate a decline in sales and profits compared to the same period last year, but an increase from the previous quarter. Investors should consider the impact of supply chain disruptions on sales and the positive effects of VAT adjustments on net profit growth."
2024-05-16,PLUG, The issuance of the Commercial Operation Certificate for Shuaa Energy 3 P.S.C's Phase C signifies a significant step towards increasing the overall capacity of the power plant. Investors can anticipate a financial impact in Q3 2024 as a result of this expansion.
2024-05-16,MCW,"The announcement allows shareholders to participate in the Ordinary General Assembly Meeting remotely, exercising their voting rights through the Tadawulaty system. This electronic voting process offers convenience and accessibility for shareholders, promoting greater engagement in the decision-making process."
2024-05-16,BA," Shareholders who meet the eligibility criteria will receive cash dividends from Theeb Rent a Car Company for the first quarter of 2024. The distribution will occur on June 4, 2024. This announcement serves as a reminder for shareholders to ensure their information is up-to-date and their bank account numbers are linked to their investment portfolios to avoid delays in receiving their dividends."
2024-05-16,9631.SR,"The reduction in accumulated losses indicates improved financial health for Alkhaleej Training and Education Co., potentially enhancing its attractiveness to investors. This development showcases the company's commitment to addressing its financial challenges and fostering a stronger financial footing."
2024-05-16,3092.SR,"The 12% reduction in production costs will benefit Riyadh Cement's financial performance, while the company's participation in the Industrial Sector Competitiveness Program demonstrates its dedication to improving energy efficiency and reducing environmental impact. This move is likely to appeal to environmentally conscious investors and enhance the company's overall competitiveness in the market."
2024-05-16,2282.SR," The Q1 2024 financial results indicate that Naqi Water Co. faces challenges in balancing its expansion strategy with maintaining profitability. Investors should monitor the company's progress in addressing these issues and executing its expansion plans. Despite the decline in sales and profits compared to the same period last year, the company's net profits increased compared to the previous quarter, demonstrating resilience in the face of challenges."
2024-05-16,3040.SR," QACCO's positive Q1 2024 financial performance suggests a strong start to the year, with notable growth in sales, profits, and earnings per share. The improved financials signal a healthy business momentum, potentially attracting investor interest and contributing to the company's overall market value."
2024-05-16,2370.SR," The positive financial performance of MESC in Q1 2024 indicates a strong start to the year. The increased profits and revenue reflect the company's ability to capitalize on market opportunities and meet the growing demand in various sectors. Investors may view these results favorably, potentially leading to increased confidence in the company's financial stability and growth prospects."
2024-05-16,2283.SR,"This electronic voting process enables shareholders to conveniently participate in the decision-making process of the company. By voting online, shareholders can efficiently exercise their rights and engage with the company's governance."
2024-05-16,1182.SR,The e-voting process offers shareholders a convenient and accessible method to participate in Amlak International Finance Co.'s Extraordinary General Assembly Meeting and influence decisions on the company's capital increase. Shareholders are encouraged to utilize the Tadawulaty platform and reach out to the Investor Relations department for any questions or concerns.
2024-05-16,3050.SR," SPCC's Q1 2024 financial results indicate a slight decline in key performance indicators compared to Q1 2023. Despite the decrease in sales and net profit, the company's total shareholders' equity increased. Investors should monitor SPCC's performance in the coming quarters to assess whether the declining trend continues or if the company can reverse it."
2024-05-19,4320.SR,"This earnings call allows Alandalus Property Co. to maintain open communication channels with its investors and financial analysts, providing them with valuable insights into the company's Q1 2024 performance. By fostering transparency and engagement, Alandalus Property Co. aims to build trust and confidence within its investor base, ultimately contributing to a stronger investment community."
2024-05-19,SIIGF,"The outcomes of the Extraordinary General Assembly Meeting reflect SIIG's commitment to transparency and corporate governance. The decisions made during the meeting, including extending the board period and electing new members, will shape the company's direction for the upcoming four years. Shareholders and stakeholders will closely monitor the implementation of these decisions and their impact on SIIG's financial performance and market standing."
2024-05-19,UCA1.HM,"The appointment of Alinma Investment Company as the financial advisor marks a significant step towards UCA's planned capital increase. Shareholders can expect further announcements once the capital increase application is submitted to the Capital Market Authority, along with any future developments related to the process."
2024-05-19,SIIGF,"These appointments come after the election of the new Board of Directors for a four-year term, from 17 May 2024 to 16 May 2028. The new leadership and representative appointments are expected to contribute to the effective management and governance of SIIG's operations and compliance with regulatory requirements."
2024-05-19,OXLC,"The announcement of the final offer price by SNB Capital marks a significant milestone in the IPO process for Saudi Manpower Solutions Company. The strong coverage ratio indicates robust demand for the shares, potentially leading to a successful IPO. Individual Investors now have the opportunity to participate in the growth story of SMASCO, gaining access to a reputable company in the human resources sector."
2024-05-19,MCW,"MIS's Q1 2024 financials reveal a substantial increase in net profit, primarily due to a capital gain from selling shares at Edarat Company. Although sales revenue decreased compared to the same period last year, the positive net profit growth demonstrates the company's ability to generate profits and deliver shareholder value. Investors may view this as a sign of the company's strong financial performance and potential for future growth."
2024-05-19,6050.SR," The interim financial results of Saudi Fisheries Co. (SFICO) for Q1 2024 indicate a decline in financial performance compared to the same quarter of the previous year and the previous quarter. The decrease in sales and profitability may raise concerns among investors, potentially affecting the company's share price and market reputation. The qualified opinion in the auditor's report may also impact investor confidence. However, SFICO's commitment to adhere to procedures and instructions issued by the capital market authority for listed companies with significant accumulated losses may help alleviate some concerns."
2024-05-19,4141.SR,"Al-Omran Industrial Trading Co.'s positive Q1 2024 financial results demonstrate improved financial performance and increased profitability compared to the same period last year. The growth in sales and gross profit, coupled with a shift from net loss to net profit, indicates a positive trend for the company. These results may attract investor interest and contribute to the company's market standing."
2024-05-19,1210.SR,"The resignation of Mr. Aziz Muhammad Mubarak Al Fahd AlQahtani from the Audit Committee of Basic Chemical Industries Co. is a regulatory compliance matter. The company thanked him for his contributions and appointed him on 15 June 2022. The resignation will take effect on 19 May 2024, in accordance with the Corporate Governance Regulations issued by the Capital Market Authority."
2024-05-19,4007.SR,"Al Hammadi Holding's Q1 2024 financials reflect a decline in sales/revenue and net profit compared to Q1 2023. The decrease in net profit is primarily due to lower revenue and higher costs. Despite the decline, the external auditor's report showed no significant concerns, suggesting that the company's financial statements are accurate and free from material misstatements."
2024-05-19,4007.SR,"Shareholders who meet the eligibility criteria will receive a cash dividend of 0.35 SAR per share, resulting in a total distribution of 56,000,000 SAR. This decision supports shareholder returns and underscores Al Hammadi Holding's commitment to rewarding its investor base."
2024-05-19,3092.SR," The Q1 2024 financial results indicate a decline in Riyadh Cement's performance compared to the same period last year. However, the shift to the TASI market and fuel price adjustments under the Industrial Sector Competitiveness Program are expected to have long-term benefits for the company's financials."
2024-05-19,2282.SR,"The decisions made during the Naqi Water Co. General Assembly Meeting will impact the company's financials, governance, and operational procedures. Shareholders will benefit from the approved dividends and interim profit distributions, while the company will continue to maintain strong corporate governance through the amendments to the work regulations of its committees and the Board of Directors."
2024-05-19,2160.SR,"Shareholders of Saudi Arabian Amiantit Co. are encouraged to participate in the Ordinary General Assembly Meeting (First Meeting) to discuss important matters, vote on various agenda items, and stay informed about the company's performance and future plans. The use of modern technology allows shareholders to conveniently attend and vote, regardless of their location."
2024-05-19,1831.SR," The decisions made during the Extraordinary General Assembly meeting will impact Maharah Human Resources Co.'s financials, governance, and operations for the fiscal year 2024 and beyond. Shareholders can expect changes in dividend distribution, Board composition, and remuneration policies. The approved transactions and contracts with affiliated companies may also influence the company's financial performance and reputation."
2024-05-19,1180.SR,"These appointments mark a significant milestone for the Saudi National Bank, as they continue to shape their leadership and drive strategic decisions for the bank's future. Investors should anticipate potential changes and initiatives under the guidance of the newly appointed board members."
2024-05-19,4071.SR,"The positive Q1 2024 financial results of Arabian Contracting Services Co. indicate continued growth in the company's operations and financial performance. The strong revenue growth, coupled with a moderate increase in net profit, suggests that the company is effectively managing its costs and expenses. The QoQ growth in net profit highlights the company's ability to maintain profitability even as expenses rise. Overall, these results demonstrate the company's resilience and potential for further growth in the coming quarters."
2024-05-20,HCC-H.V,"The release of the circular and associated documents marks a significant step forward in the share exchange transaction between HCC and QCC. Shareholders of HCC should closely examine the information provided to make informed decisions regarding their involvement in the transaction. The publication of these materials moves the transaction closer to completion, potentially impacting the financial results and strategic positioning of both companies."
2024-05-20,HCC-H.V," The Extraordinary General Assembly Meeting is a significant event for Hail Cement Co. shareholders, as they will vote on Qassim Cement Company's offer to acquire all HCC shares. Shareholders should carefully review the Board Circular and Offer Document before making their decision. The outcome of the vote will determine the future of HCC and its shareholders, potentially leading to HCC becoming an unlisted joint stock company wholly owned by QCC."
2024-05-20,9566.SR,"This acquisition represents a significant expansion for Saudi Lime Industries, as they integrate Astra Mining Limited Company into their operations. The financial consequences of this transaction will become apparent in the latter half of the fiscal year 2024, potentially influencing the company's overall performance and investor decisions."
2024-05-20,4320.SR,The 18th Ordinary General Assembly Meeting of Alandalus Property Co. has been concluded with full participation from the Board of Directors and committee chairmen. The meeting's outcomes will be implemented according to the voting results on the attached agenda items. Shareholders can address any inquiries to the Investor Relations Department.
2024-05-20,3040.SR," The release of these documents marks a significant step towards completing the share exchange transaction between QCC and HCC. Shareholders from both companies should carefully review the provided materials to make informed decisions. This transaction is expected to have implications for both QCC and HCC, influencing their financial landscapes and strategic directions."
2024-05-20,2282.SR,"The appointment of Mr. Nawaf Yousef Al-gafari to Naqi Water Co.'s Audit Committee will contribute to the company's financial oversight and governance. As an experienced finance professional, his expertise will support the committee's role in ensuring the accuracy and reliability of the company's financial statements."
2024-05-20,1214.SR,"This adjustment in fluctuation limits will impact the trading of Al Hassan Ghazi Ibrahim Shaker Co. shares, affecting both buy and sell orders. Investors need to be aware of the new share price and place their orders accordingly. The capital increase through bonus shares will dilute the existing shares, while providing additional shares to existing investors without additional cost."
2024-05-20,1214.SR,"The outcome of the Extraordinary General Assembly meeting does not contain any significant announcements or decisions affecting the company's operations or financial status. However, the meeting summary provides insight into the company's governance structure and shareholder engagement."
2024-05-20,1213.SR," The appointment of Wasatah Capital as a financial advisor signifies a significant step forward in Naseej International Trading Co.'s acquisition process of Etmam Arabia Real Estate Development Company. This move demonstrates Naseej's commitment to completing the acquisition, and the involvement of a financial advisor is expected to streamline the transaction process."
2024-05-20,3040.SR," The EGM's outcome will determine the completion of the Transaction between QCC and HCC. If the proposed capital increase is approved, HCC's shareholders will receive 0.21 share in QCC for each HCC share owned upon Transaction completion. The success of the EGM is crucial for the merger, which aims to enhance the companies' competitiveness and market presence."
2024-05-21,9557.SR,"The announcement allows Edarat's shareholders to participate in the decision-making process by casting their votes electronically on the agenda items prior to the general assembly meeting. This remote participation option ensures a more inclusive and accessible experience for all shareholders, regardless of their location."
2024-05-21,MCW,"The successful conclusion of the Ordinary General Assembly Meeting represents a significant milestone for Al Moammar Information Systems Co. The approval of the financial statements, appointment of auditors, and discharging of Board members' liability ensures the company's continued compliance with regulatory requirements. The authorization of interim dividends and remuneration payments demonstrates the company's commitment to rewarding its shareholders and incentivizing its Board members."
