Date,ticker,Impact,t0,t1,r_stock_1d,r_index_1d,ar_1d,label
2024-05-08,4330.SR,"The earnings conference call aims to enhance transparency and engagement with the financial community. By providing detailed insights into the company's Q1-2024 performance, Riyadh Cables Group Co. seeks to strengthen its relationship with investors and analysts, offering them the opportunity to ask questions and gain a better understanding of the company's financial health.",2024-05-08,2024-05-09,-0.011688269867544543,-0.014101014385516029,0.0024127445179714865,1
2024-05-08,4150.SR," Investors should note the mixed financial performance of ARDCO for Q1 2024. While the company showed growth in sales, gross profit, and operational profit, the significant decline in net profit may raise concerns. However, the rise in total shareholders' equity could be seen as a positive sign. As always, potential investors should carefully analyze the complete financial report and consider seeking advice from financial advisors before making investment decisions.",2024-05-08,2024-05-09,0.02292024311409483,-0.014101014385516029,0.03702125749961086,1
2024-05-08,1120.SR,"The proposed issuance of U.S. Dollar-denominated additional tier 1 capital sustainable sukuk by Al Rajhi Bank is aimed at enhancing its Tier 1 capital and achieving its financial and strategic objectives within the bank's Sustainable Finance Framework. This move is expected to provide the bank with greater flexibility in managing its capital base and catering to its growing financing needs, while also promoting sustainable finance practices.",2024-05-08,2024-05-09,-0.0099626777254562,-0.014101014385516029,0.004138336660059829,1
2024-05-08,7010.SR,stc shareholders will receive interim dividends of SAR 0.40 per share for the 1st quarter of 2024. Eligible shareholders should ensure their data is up-to-date and their bank accounts are linked to their investment portfolios. Foreign non-resident investors will be subject to a 5% withholding tax on dividends.,2024-05-08,2024-05-09,0.007863675624155441,-0.014101014385516029,0.02196469000967147,1
2024-05-09,8260.SR," Shareholders can expect updates regarding the capital increase process once the company submits the relevant files to the Capital Market Authority. The appointment of Alinma Investment as the financial advisor signifies progress towards the capital increase, which could potentially lead to new investment opportunities and strengthened financial stability for Gulf General Cooperative Insurance Company.",2024-05-09,2024-05-12,-0.026764021883460307,-0.005483401376681382,-0.021280620506778924,0
2024-05-09,8120.SR,"The Q1 2024 financial results of Gulf Union Alahlia indicate a mixed performance in revenue and profitability compared to the same period last year and the previous quarter. Despite growth in insurance revenues, the company experienced a decline in net profit and total comprehensive income. Investors should monitor the company's performance closely to assess its ability to navigate challenges and maintain growth.",2024-05-09,2024-05-12,-0.04320985577820664,-0.005483401376681382,-0.037726454401525264,0
2024-05-09,1120.SR,"Al Rajhi Bank's offer of U.S. dollar denominated additional tier 1 capital sustainable sukuk presents an opportunity for eligible investors in the Kingdom of Saudi Arabia and internationally to participate in the bank's sustainable investment strategy. The bank has appointed a strong lineup of joint lead managers and bookrunners, ensuring a robust and efficient issuance process. The sukuk's listing on the London Stock Exchange's International Securities Market enhances its visibility and appeal to a broader investor base.",2024-05-09,2024-05-12,-0.006289308176100629,-0.005483401376681382,-0.0008059067994192473,0
2024-05-09,2080.SR,"GASCO's strong Q1 2024 financial performance indicates positive growth trends for the company. The increased revenue and net profit demonstrate improved operational efficiency and financial management. These results may encourage investor confidence and potentially lead to increased investments in the company, contributing to its continued success in the energy sector.",2024-05-09,2024-05-12,0.0034682433729226877,-0.005483401376681382,0.00895164474960407,1
2024-05-09,1213.SR," The Q1 2024 financial results of Naseej International Trading Co. show a mixed performance, with declines in key metrics compared to the same period last year, but improvements over the previous quarter. Investors should closely monitor the company's performance and its ability to navigate challenging market conditions. The unmodified conclusion in the external auditor's report indicates that the financial statements are presented fairly, providing confidence in the company's financial reporting.",2024-05-09,2024-05-12,0.01866668701171875,-0.005483401376681382,0.02415008838840013,1
2024-05-09,2222.SR," The appointment of Al Bilad Capital as the financial advisor marks a crucial step in Saudi Cable Co.'s plan to raise its capital by SAR 400,000,000. This move is expected to strengthen the company's financial position and support its growth. Further updates regarding the rights issue will be shared as they unfold, in compliance with regulatory requirements.",2024-05-09,2024-05-12,0.0033500964888363875,-0.005483401376681382,0.00883349786551777,1
2024-05-12,4020.SR,"The contract's successful signing with Diriyah Gate Company Limited (DGCL) marks a significant milestone for Al-Akaria, generating substantial revenue over the 437-day project duration. This development is expected to positively impact Al-Akaria's financial performance from Q4 2023 to Q1 2025, demonstrating the company's strong position in the infrastructure development sector.",2024-05-12,2024-05-13,-0.008137445675703665,0.003482821578673951,-0.011620267254377616,0
2024-05-12,8120.SR," Shareholders of Gulf Union Al Ahlia Cooperative Insurance Co. are encouraged to participate in the Ordinary General Assembly Meeting (First Meeting) by registering and voting electronically through the Tadawulaty Platform. This meeting offers shareholders the opportunity to discuss the agenda topics, ask questions, and exercise their voting rights remotely.",2024-05-12,2024-05-13,0.0009215921526230438,0.003482821578673951,-0.002561229426050907,0
2024-05-12,8060.SR," The positive Q1 2024 financial results of Walaa Cooperative Insurance Co. reflect an improved financial performance, driven by growth in insurance revenues and increased net investment results. The substantial increase in net profit after zakat indicates enhanced profitability, which could potentially attract more investors and contribute to the company's market reputation. However, the increase in insurance service result (loss) may require further investigation and potential corrective actions.",2024-05-12,2024-05-13,-0.09983075911186616,0.003482821578673951,-0.10331358069054011,0
2024-05-12,6070.SR,"The strong Q1 2024 financial performance of Al-Jouf Agricultural Development Co. demonstrates the success of their expansion efforts, particularly the new French fries factory. Investors may view this growth as a positive sign, potentially attracting increased interest in the company's shares. However, it remains essential to monitor future financial results and operational performance to assess the sustainability of this positive trend.",2024-05-12,2024-05-13,0.0782608695652174,0.003482821578673951,0.07477804798654344,1
2024-05-12,4162.SR,"Almunajem Foods Co.'s Q1 2024 financial performance demonstrates solid growth, driven by increased sales volumes and improved margins in various product categories. The positive results indicate a healthy financial position for the company, with increased net profit and revenue compared to both the same quarter of the previous year and the previous quarter.",2024-05-12,2024-05-13,-0.06698565728601998,0.003482821578673951,-0.07046847886469393,0
2024-05-12,4082.SR," The Q1 2024 financial results of Morabaha Marina Financing Co. indicate a positive trend in sales/revenue, but a substantial decrease in net profit. Investors should monitor the company's performance closely to assess the impact of increased expenses on future earnings. Despite the decline in net profit, the company's sales growth suggests a potential recovery in overall financial performance.",2024-05-12,2024-05-13,-0.0036363601684570312,0.003482821578673951,-0.0071191817471309825,0
2024-05-12,4003.SR,"The Ordinary General Assembly Meeting of eXtra provided shareholders with an opportunity to engage in the decision-making process and stay informed about the company's performance and future plans. The voting results and committee reports, once disclosed, will shed light on the company's direction and potential developments.",2024-05-12,2024-05-13,0.018218576586686214,0.003482821578673951,0.014735755008012262,1
2024-05-12,2120.SR,"At this stage, there is no direct financial impact mentioned in the announcement. The company aims to increase its capital by offering rights issues, and the appointment of Al Bilad Capital as an underwriter and financial advisor is a significant step towards achieving this goal.",2024-05-12,2024-05-13,-0.024811170421585378,0.003482821578673951,-0.028293992000259328,0
2024-05-12,2222.SR," The Q1 2024 financial results of Saudi Electricity Company indicate a positive trend in sales, gross profit, operational profit, and net profit compared to the same period last year. This performance is likely to be welcomed by investors, as it demonstrates the company's ability to navigate challenging market conditions and maintain growth. The increase in net profit will likely contribute to the company's overall financial stability and help fund future projects and investments.",2024-05-12,2024-05-13,0.0,0.003482821578673951,-0.003482821578673951,0
2024-05-12,2200.SR,"The robust financial performance of APC in Q1 2024 highlights the company's successful strategies in increasing sales volume and improving production efficiency. Investors may find these results encouraging, potentially driving interest in APC shares. However, it is essential to monitor the company's performance in the coming quarters to assess the sustainability of this growth.",2024-05-12,2024-05-13,0.017112360254514774,0.003482821578673951,0.013629538675840823,1
2024-05-12,1831.SR," The introduction of electronic voting for Maharah Human Resources Co.'s Extraordinary General Assembly Meeting offers convenience and flexibility to shareholders, allowing them to participate and vote remotely. This initiative streamlines the voting process and encourages broader shareholder engagement.",2024-05-12,2024-05-13,-0.0016180829000712093,0.003482821578673951,-0.00510090447874516,0
2024-05-12,1301.SR,"The extension of the memorandum of understanding demonstrates both parties' commitment to exploring the potential acquisition. This development may lead to further negotiations and, if successful, result in a diversified investment for United Wire Factories Co., potentially enhancing its profitability.",2024-05-12,2024-05-13,-0.008670498563314385,0.003482821578673951,-0.012153320141988336,0
2024-05-12,1180.SR,"This conference call allows stakeholders to gain insights into the bank's financial performance during Q1 2024. By providing contact details for the Shareholder Affairs Department, the Saudi National Bank facilitates investor participation, encouraging transparency and open communication with its stakeholders.",2024-05-12,2024-05-13,0.005602262147486451,0.003482821578673951,0.0021194405688125004,1
2024-05-12,1120.SR,The successful completion of Al Rajhi Bank's sukuk offer represents a significant milestone in the bank's capital management strategy. The USD 1 billion sukuk issuance enhances the bank's capital adequacy ratio and supports its growth plans. Investors will benefit from the 6.375% annual return and the potential for capital appreciation as the sukuk is callable after 5 years. The listing on the London Stock Exchange increases the visibility of Al Rajhi Bank in the international market.,2024-05-12,2024-05-13,-0.0012658034698872626,0.003482821578673951,-0.0047486250485612135,0
2024-05-12,2300.SR," The positive Q1 2024 financial performance of Saudi Paper Manufacturing Co. indicates strengthened market position and operational efficiency. The results are expected to bolster investor confidence, potentially attracting new investments and contributing to the company's continued growth.",2024-05-12,2024-05-13,-0.026582259166089795,0.003482821578673951,-0.030065080744763745,0
2024-05-13,8311.SR," The Q1 2024 financial results of Enaya Cooperative Insurance Co. indicate a challenging start to the year, with a substantial decrease in net profit due to unfavorable movements in various financial components. However, the company managed to partially offset these negative impacts through increased net investment results and reduced operating expenses. Investors should closely monitor the company's performance throughout the year to assess its ability to navigate these challenges and improve its financial position.",2024-05-13,2024-05-14,0.006211203670828596,-0.011312722890145876,0.01752392656097447,1
2024-05-13,8200.SR,"The General Assembly Meeting outcomes will impact Saudi Re's financial management and governance. Shareholders' approval of financial statements, auditor appointments, and reinsurance contracts ensures transparency and regulatory compliance. The remuneration decision supports the board members' commitment and involvement in the company's success.",2024-05-13,2024-05-14,-0.04197081246091134,-0.011312722890145876,-0.030658089570765462,0
2024-05-13,4190.SR," Jarir Marketing Co.'s Q1 2024 financial performance shows a decline in sales, gross profit, operational profit, and net profit compared to both Q1 2023 and the previous quarter. This may raise concerns among investors regarding the company's short-term performance and market position. However, it is important to consider the company's long-term strategies and overall market conditions when evaluating its financial health.",2024-05-13,2024-05-14,0.004491049487917567,-0.011312722890145876,0.015803772378063442,1
2024-05-13,4190.SR,"This dividend distribution will benefi shareholders who own Jarir Marketing Company stocks, providing them with a 19% return on share par value. To qualify, shareholders must hold their shares until the eligibility date and ensure proper registration with the Depository Center.",2024-05-13,2024-05-14,0.004491049487917567,-0.011312722890145876,0.015803772378063442,1
2024-05-13,4002.SR," The Q1 2024 financial results of Mouwasat Medical Services Co. show a positive YoY trend in revenues and net profit, despite a slight QoQ decline. Investors should consider the impact of seasonality and debt provisions on profit margins. The company encourages investors and financial analysts to send inquiries to Shares@mouwasat.com for further clarification.",2024-05-13,2024-05-14,-0.09200606346965515,-0.011312722890145876,-0.08069334057950928,0
2024-05-13,2382.SR,"The impressive financial results of ADES Holding Co. for Q1 2024 indicate a positive trend for the company. The strong revenue growth and margin enhancements have led to a significant increase in net profit, demonstrating the company's ability to effectively manage its operations and finances. The growth in revenue and net profit is expected to positively impact ADES's market position and investor confidence.",2024-05-13,2024-05-14,-0.023281599499944808,-0.011312722890145876,-0.011968876609798932,0
2024-05-13,2283.SR,"The share buy-back is not anticipated to have a significant financial impact on First Milling Company's financial results. This move supports the company's efforts to motivate and retain key employees, ultimately contributing to the achievement of its strategic goals.",2024-05-13,2024-05-14,-0.025925907087914736,-0.011312722890145876,-0.01461318419776886,0
2024-05-13,8170.SR,"Al-Etihad Cooperative Insurance Co.'s Q1 2024 financials indicate a challenging quarter, with a significant decline in net profit and total comprehensive income. The company's earnings per share also decreased considerably compared to the same period last year. However, the increase in insurance revenues and gross written premiums demonstrates some positive developments in core business operations.",2024-05-13,2024-05-14,-0.07454544894075679,-0.011312722890145876,-0.06323272605061092,0
2024-05-14,9543.SR,The change in audit committee membership may affect the company's financial oversight and reporting processes. Investors should monitor the company's announcements regarding any potential impacts on financial reporting and regulatory compliance.,2024-05-14,2024-05-15,0.020134228187919462,-0.0014611081766304549,0.021595336364549918,1
2024-05-14,4090.SR," Taiba Investments Co.'s strong Q1 financial performance indicates a positive outlook for the company, driven by the acquisition of Dur Hospitality Co. and growth in the hospitality sector. The robust results could potentially attract investor interest and contribute to the company's market reputation. However, investors should consider the sustainability of this growth in the upcoming quarters.",2024-05-14,2024-05-15,-0.001088122660073453,-0.0014611081766304549,0.00037298551655700176,1
2024-05-14,9543.SR,The resignation of Mr. Asher Noor Nisar Akhtar from the Board of Directors of Saudi Networkers Services Co. will result in a change in the composition of the board. The company will need to identify and appoint a suitable replacement to maintain the board's effectiveness and ensure continuity in decision-making processes.,2024-05-14,2024-05-15,0.020134228187919462,-0.0014611081766304549,0.021595336364549918,1
2024-05-14,4003.SR,"The formation of the Audit Committee at eXtra demonstrates the company's commitment to maintaining robust corporate governance practices. The committee members' extensive backgrounds in governance, finance, and auditing will contribute significantly to the company's financial oversight and strategic decision-making.",2024-05-14,2024-05-15,-0.003076954377003205,-0.0014611081766304549,-0.00161584620037275,0
2024-05-14,1210.SR,"BCI's Q1 2024 financials demonstrate a positive trend in revenue growth and a significant improvement in net profit. These results reflect the company's ability to effectively manage costs and optimize operations, ultimately delivering enhanced value to shareholders. Investors may view these financials as a sign of BCI's strong commitment to operational excellence and financial discipline.",2024-05-14,2024-05-15,-0.07565337318948794,-0.0014611081766304549,-0.07419226501285749,0
2024-05-15,4100.SR, The positive Q1-2024 financial results of Makkah Construction and Development Co. indicate strong performance and growth potential. The improvements in revenue and net profit are likely to attract investor interest and contribute to the company's market standing.,2024-05-15,2024-05-16,-0.009784738293987478,0.007869012561808735,-0.017653750855796214,0
2024-05-15,4051.SR," The non-convening of the Extraordinary General Assembly Meetings does not affect the company's financials, external auditor work, or capital structure. The company will continue to operate as usual until the third extraordinary general assembly meeting is held, where decisions will be made based on the board of directors' recommendations.",2024-05-15,2024-05-16,-0.007385552566577772,0.007869012561808735,-0.015254565128386507,0
2024-05-15,2200.SR,"The Ordinary General Assembly meeting of Arabian Pipes Company has concluded, providing shareholders with updates on the company's performance and future plans. The outcomes of the meeting, including voting results on various agenda items, are documented and available for review.",2024-05-15,2024-05-16,-0.038202213419307615,0.007869012561808735,-0.04607122598111635,0
2024-05-15,2100.SR,"Wafrah for Industry and Development Co.'s strong Q1 2024 financial performance highlights the success of its sales expansion strategies and the vegetable sector's contribution. Investors will likely view this positively, potentially driving up the share price and attracting further investment. However, it is essential to monitor the company's ability to maintain this growth throughout the year and address any potential challenges in managing increased expenses.",2024-05-15,2024-05-16,-0.029029043859700707,0.007869012561808735,-0.036898056421509444,0
2024-05-15,1833.SR,"Al Mawarid Manpower Co.'s Q1 2024 financial performance shows a positive trend, with substantial growth in sales/revenue and net profit. This improvement indicates a healthy financial position and increased investor confidence. The company's focus on expanding its workforce and enhancing revenue generation has contributed to the overall growth, making it an attractive investment opportunity.",2024-05-15,2024-05-16,0.02597404205893575,0.007869012561808735,0.018105029497127015,1
2024-05-15,1831.SR," Maharah Human Resources Co.'s positive Q1 2024 financial performance reflects the company's strategic focus on core sectors, associates, and subsidiaries. The growth in revenue and net profit indicates improving market conditions and the company's ability to capitalize on opportunities. Investors should closely monitor Maharah's continued progress and performance.",2024-05-15,2024-05-16,0.04126980066239491,0.007869012561808735,0.03340078810058618,1
2024-05-15,1301.SR,"Investors should take note of the declining revenue and profits compared to the same period last year, but also acknowledge the improvement in net profit and total comprehensive income compared to the previous quarter. The fluctuations in sales volume and zakat expenses have affected the company's financial performance, and stakeholders should monitor these factors moving forward.",2024-05-15,2024-05-16,-0.03387338733536267,0.007869012561808735,-0.041742399897171406,0
2024-05-15,2222.SR,"Shareholders of Saudi Electricity Company have approved the distribution of dividends, marking a significant financial event for the company and its investors. The approval of the Board's recommendations and the discharge of their liabilities demonstrate the company's commitment to transparency and accountability. The event highlights the company's strong financial performance and its intention to reward shareholders, potentially attracting new investors and bolstering market confidence.",2024-05-15,2024-05-16,0.01535838821354858,0.007869012561808735,0.007489375651739846,1
2024-05-16,4051.SR," Baazeem Trading Co.'s Q1 2024 financial results indicate a decline in sales and profits compared to the same period last year, but an increase from the previous quarter. Investors should consider the impact of supply chain disruptions on sales and the positive effects of VAT adjustments on net profit growth.",2024-05-16,2024-05-19,0.0,-4.963493107909622e-06,4.963493107909622e-06,1
2024-05-16,3092.SR,"The 12% reduction in production costs will benefit Riyadh Cement's financial performance, while the company's participation in the Industrial Sector Competitiveness Program demonstrates its dedication to improving energy efficiency and reducing environmental impact. This move is likely to appeal to environmentally conscious investors and enhance the company's overall competitiveness in the market.",2024-05-16,2024-05-19,0.0,-4.963493107909622e-06,4.963493107909622e-06,1
2024-05-16,2282.SR," The Q1 2024 financial results indicate that Naqi Water Co. faces challenges in balancing its expansion strategy with maintaining profitability. Investors should monitor the company's progress in addressing these issues and executing its expansion plans. Despite the decline in sales and profits compared to the same period last year, the company's net profits increased compared to the previous quarter, demonstrating resilience in the face of challenges.",2024-05-16,2024-05-19,0.0,-4.963493107909622e-06,4.963493107909622e-06,1
2024-05-16,3040.SR," QACCO's positive Q1 2024 financial performance suggests a strong start to the year, with notable growth in sales, profits, and earnings per share. The improved financials signal a healthy business momentum, potentially attracting investor interest and contributing to the company's overall market value.",2024-05-16,2024-05-19,0.0,-4.963493107909622e-06,4.963493107909622e-06,1
2024-05-16,2370.SR," The positive financial performance of MESC in Q1 2024 indicates a strong start to the year. The increased profits and revenue reflect the company's ability to capitalize on market opportunities and meet the growing demand in various sectors. Investors may view these results favorably, potentially leading to increased confidence in the company's financial stability and growth prospects.",2024-05-16,2024-05-19,0.0,-4.963493107909622e-06,4.963493107909622e-06,1
2024-05-16,2283.SR,"This electronic voting process enables shareholders to conveniently participate in the decision-making process of the company. By voting online, shareholders can efficiently exercise their rights and engage with the company's governance.",2024-05-16,2024-05-19,-0.006435006687748802,-4.963493107909622e-06,-0.006430043194640893,0
2024-05-16,1182.SR,The e-voting process offers shareholders a convenient and accessible method to participate in Amlak International Finance Co.'s Extraordinary General Assembly Meeting and influence decisions on the company's capital increase. Shareholders are encouraged to utilize the Tadawulaty platform and reach out to the Investor Relations department for any questions or concerns.,2024-05-16,2024-05-19,0.0,-4.963493107909622e-06,4.963493107909622e-06,1
