Date,ticker,Impact,t0,t1,r_stock_1d,r_index_1d,ar_1d,label
2024-03-14,3050.SR,"The proposed cash dividend distribution is expected to benefit SPCC shareholders with a 0.65 SAR return per share. The total distribution of 91,000,000 SAR will be shared among 140,000,000 eligible shares. Non-resident investors should be aware of the 5% withholding tax on cash dividends. Shareholders are encouraged to update their data with their respective banks to ensure timely receipt of their dividends.",2024-03-14,2024-03-17,-0.003816735727571982,0.0026632622411436537,-0.006479997968715636,0
2024-03-14,2222.SR," The substantial decline in Saudi Top for Trading Co.'s financial results might raise concerns among investors, potentially affecting the company's stock price and market reputation. The company will need to address these challenges and implement strategies to improve profitability and restore investor confidence.",2024-03-14,2024-03-17,-0.00320001220703125,0.0026632622411436537,-0.005863274448174903,0
2024-03-14,2020.SR,"The appointment of Mr. Fahad Misfer Al-Battar as CEO of SABIC Agri-Nutrients Company signifies a strategic move in the company's leadership. With his extensive experience and strong background in the petrochemicals and Agri-Nutrients sector, the new CEO is expected to lead the company towards further growth and success.",2024-03-14,2024-03-17,0.013201370823457192,0.0026632622411436537,0.010538108582313539,1
2024-03-14,2300.SR," The strong financial performance of Saudi Paper Manufacturing Co. indicates improved operational efficiency and market expansion. The positive results may attract investor interest, potentially leading to increased share prices and market capitalization.",2024-03-14,2024-03-17,-0.014986376177570813,0.0026632622411436537,-0.017649638418714468,0
2024-03-24,2081.SR,"Alkhorayef Water and Power Technologies holds a 50% stake in the consortium responsible for the IWTP project, which is anticipated to significantly contribute to the drinking water supply in the Makkah and Madinah regions. The successful financial closing of the project marks a crucial milestone, highlighting the company's commitment to investing in essential infrastructure and advancing the water transmission capabilities in the Kingdom of Saudi Arabia.",2024-03-24,2024-03-25,0.0,-0.010874369886552868,0.010874369886552868,1
2024-03-24,4002.SR,The positive financial performance of Mouwasat Medical Services Co. indicates a healthy growth trend in the company's operations. The double-digit percentage increase in both sales revenue and net profit is expected to attract investor attention and contribute to the company's market standing. This financial success can potentially lead to increased investments and further expansion of Mouwasat's healthcare services.,2024-03-24,2024-03-25,0.011437920820474054,-0.010874369886552868,0.02231229070702692,1
2024-03-25,9543.SR," The positive 2023 financial results of Saudi Networkers Services Co. demonstrate strong growth and financial stability. The continued revenue growth and increased net profit are likely to attract investor interest, potentially leading to increased market capitalization and shareholder value. The unmodified auditor's opinion further instills confidence in the company's financial reporting.",2024-03-25,2024-03-26,-0.01178012444900344,-0.005641204604038962,-0.006138919844964478,0
2024-03-25,9557.SR,"Shareholders' participation in this meeting is crucial for decision-making on important matters such as the proposed capital increase, auditor's report, and board member rewards. By engaging in the voting process, shareholders can help shape the future direction of the company and ensure their interests are represented. The electronic voting system allows shareholders to conveniently exercise their rights and influence EDARAT's development.",2024-03-25,2024-03-26,0.03718199608610567,-0.005641204604038962,0.042823200690144635,1
2024-03-25,9543.SR,"Shareholders of Saudi Networkers Services Co. can expect cash dividends for the second half of 2023, subject to approval by the General Assembly. Non-resident investors should be aware of the 5.0% withholding tax on dividends. Timely updating of shareholder information and bank account linkage will ensure efficient dividend disbursement.",2024-03-25,2024-03-26,-0.01178012444900344,-0.005641204604038962,-0.006138919844964478,0
2024-03-25,1010.SR,The announcement of the ordinary General Assembly Meeting results confirms Riyad Bank's commitment to transparency and engaging with its shareholders. The strong attendance rate indicates investor interest in the bank's operations and future plans. The meeting's outcomes will likely in uence shareholder decisions and contribute to the bank's strategic direction.,2024-03-25,2024-03-26,0.005093365522728147,-0.005641204604038962,0.01073457012676711,1
2024-03-25,8311.SR,"These appointments and formations reflect Saudi Enaya Cooperative Insurance Co.'s commitment to adhering to regulatory requirements and maintaining a strong governance structure. The new leadership and subcommittees will contribute to the company's strategic direction and decision-making processes, ultimately benefiting stakeholders and the overall performance of the organization.",2024-03-25,2024-03-26,-0.043478220306857156,-0.005641204604038962,-0.037837015702818194,0
2024-03-25,4100.SR," Shareholders of Makkah Construction and Development Co. can expect to receive cash dividends for the fiscal year 2023, pending approval from the general assembly and regulatory authorities. The dividend per share amounts to 1.5%, representing a 15% return on the share par value. Shareholders are advised to update their bank information to facilitate the direct deposit of dividends into their accounts.",2024-03-25,2024-03-26,0.04901962119097702,-0.005641204604038962,0.05466082579501598,1
2024-03-25,1321.SR,"This contract marks a significant milestone for East Pipes, as they expand their operations in the manufacturing and supply of steel pipes to Saline Water Conversion Corporation. The agreement will have a positive financial impact on East Pipes for multiple years, commencing in the 1st quarter of the financial year 2024/2025.",2024-03-25,2024-03-26,-0.028273719981680368,-0.005641204604038962,-0.022632515377641407,0
2024-03-25,9523.SR,"This contract is expected to contribute significantly to Group Five Pipe Saudi Co.'s financial performance, with the infl uence becoming apparent in the third quarter of the fiscal year 2024. The company's involvement in the Ras Al-Khair water transportation system project demonstrates its commitment to delivering high-quality piping solutions for essential infrastructure projects, further solidifying its position in the market.",2024-03-25,2024-03-26,-0.02050117299764462,-0.005641204604038962,-0.01485996839360566,0
2024-03-26,4021.SR,"Shareholders benefitting from this dividend distribution must meet the eligibility criteria, which includes owning shares on the specified date and being registered in the Securities Depository Center Company. The automatic dividend deposit aims to streamline the process for shareholders while ensuring timely receipt of their profits. Foreign investors should factor in the 5% withholding tax when anticipating their dividends.",2024-03-26,2024-03-27,-0.00699303357593785,0.0017830327199190726,-0.008776066295856923,0
2024-03-26,9590.SR,"Armah Sports Co.'s impressive financial performance, marked by a 507% surge in revenue and a return to profitability, reflects the company's successful expansion and service enhancement strategies. This positive trend is expected to continue, given the company's ability to manage operational and financial challenges effectively.",2024-03-26,2024-03-27,0.011270476345476187,0.0017830327199190726,0.009487443625557115,1
2024-03-26,4280.SR,"The announcement of cash dividends for the fiscal year 2023 by Kingdom Holding Co. is expected to positively affect shareholder value. Shareholders who meet the eligibility criteria will receive a dividend of SAR 0.28 per share, contributing to a 2.8% return on the share par value. Investors are encouraged to stay updated on the eligibility and distribution dates, as well as ensure their banking information is current to facilitate dividend deposits.",2024-03-26,2024-03-27,-0.005412714827564647,0.0017830327199190726,-0.0071957475474837196,0
2024-03-26,3020.SR, The approval of dividends and the re-election of the Board of Directors' members will likely maintain investor confidence in the company. The approval of transactions and contracts with related parties will enable Yamama Cement Company to continue its operations and maintain relationships with various stakeholders.,2024-03-26,2024-03-27,0.004392319311258953,0.0017830327199190726,0.0026092865913398804,1
2024-03-26,6070.SR,"The formation of the new Audit Committee demonstrates Al-Jouf Agricultural Development Company's commitment to maintaining strong internal controls and financial transparency. The committee members' extensive experience in accounting, finance, and business administration will contribute significantly to the company's financial oversight and governance. Investors may view this development as a positive step towards ensuring the company's financial stability and integrity. ",2024-03-26,2024-03-27,0.023550710490811245,0.0017830327199190726,0.021767677770892172,1
2024-03-26,1303.SR,"This contract marks a significant milestone for Electrical Industries Co. and its subsidiary, Saudi Power Transformers Co., as it extends their presence in the Saudi Arabian market and strengthens their relationship with Larsen &Toubro Saudi Arabia. The 20-month contract, valued at over SAR 125 million, is expected to positively impact the company's financial results in 2026. This development highlights the company's expertise in providing transformer solutions for large-scale energy projects, such as Aramco's Jafoura Gas Project.",2024-03-26,2024-03-27,0.022222201029459637,0.0017830327199190726,0.020439168309540564,1
2024-03-26,1150.SR,"The CMA's approval of Alinma Bank's capital increase will lead to a stronger financial position for the bank, enabling it to pursue new business opportunities and boost shareholder value. The distribution of bonus shares will likely result in increased shareholding and potentially higher investor confidence in the bank.",2024-03-26,2024-03-27,-0.02022464710298376,0.0017830327199190726,-0.02200767982290283,0
2024-03-26,1150.SR,"The CMA's approval of Alinma Bank's capital increase is expected to bolster the bank's financial position and enable it to pursue new business opportunities. Shareholders will benefit from the distribution of bonus shares, while potential investors may view this move as a positive signal, possibly attracting increased interest in the bank's shares.",2024-03-26,2024-03-27,-0.02022464710298376,0.0017830327199190726,-0.02200767982290283,0
2024-03-26,2282.SR,"The declaration of dividends by Naqi Water Co. indicates a positive financial performance for the second half of 2023. Eligible shareholders can expect to receive a 0.50 SAR dividend per share, subject to meeting the eligibility criteria. This announcement may in uence the company's stock price and attract potential investors, contributing to the overall growth of the company.",2024-03-26,2024-03-27,0.005427429341141196,0.0017830327199190726,0.0036443966212221235,1
2024-03-26,1201.SR, This loan repayment move by Takween Advanced Industries demonstrates a proactive financial management strategy to counteract the effects of rising interest rates. The improved financial indicators resulting from this repayment may strengthen the company's financial position and potentially attract more investors seeking stable fi nancial performance.,2024-03-26,2024-03-27,0.0015220322349168318,0.0017830327199190726,-0.0002610004850022408,0
2024-03-26,1301.SR,"The approval of this recommendation by the General Assembly would result in an increase in the company's retained earnings, potentially strengthening its financial position and providing greater flexibility in managing its financial resources.",2024-03-26,2024-03-27,0.019431919173580354,0.0017830327199190726,0.01764888645366128,1
2024-03-27,1833.SR,Shareholders benefiting from this dividend distribution are those who own shares in Al Mawarid Manpower Company before the specified eligibility date. Foreign investors need to consider potential tax implications. The company's focus on accurate data and communication with shareholders aims to facilitate efficient dividend transfers.,2024-03-27,2024-03-28,-0.09014083074292106,-0.0033384268334509114,-0.08680240390947015,0
2024-03-27,1833.SR,"Al Mawarid Manpower Co.'s strong financial performance in 2023 demonstrates the company's ability to capitalize on market opportunities and manage costs effectively. The positive results may attract investor interest and contribute to the company's market reputation. However, investors should also consider potential risks and challenges that could impact future financial performance.",2024-03-27,2024-03-28,-0.09014083074292106,-0.0033384268334509114,-0.08680240390947015,0
2024-03-27,2382.SR," This agreement signifies ADES' commitment to expanding its operations in Egypt and contributing to the country's oil production growth. The $66 million investment over three years is expected to generate substantial returns for ADES, given its entitlement to incremental production based on a mutually agreed formula.",2024-03-27,2024-03-28,-0.002881818771462253,-0.0033384268334509114,0.0004566080619886584,1
2024-03-27,3020.SR,"The successful acquisition of funding by Yamama Cement Company from Alinma Bank demonstrates the company's strong financial position and its commitment to maintaining prudent financial management practices. The diversified financing structure allows Yamama Cement Company to optimize its liabilities, invest in infrastructure projects, and manage day-to-day operations effectively. This strategic move is expected to strengthen the company's competitiveness in the cement market and contribute to its sustained growth.",2024-03-27,2024-03-28,-0.018950371009901643,-0.0033384268334509114,-0.015611944176450732,0
2024-03-27,4071.SR,"This contract win signifies a significant expansion for Arabian Contracting Services Co.'s subsidiary, Faden Media Company, in the outdoor advertising market in Riyadh City. Investors can expect potential revenue growth for Arabian Contracting Services Co. over the next 10 years due to this project, contributing to the company's financial performance and market presence.",2024-03-27,2024-03-28,-0.02705063133274294,-0.0033384268334509114,-0.02371220449929203,0
2024-03-27,4090.SR,"Taiba Investments Co.'s strong sales/revenue growth and solid comprehensive income reflect a positive financial performance, while the decline in net profit suggests a short-term impact from acquisition-related costs and legal provisions. Overall, the company's financial health appears robust, offering potential reassurance to investors.",2024-03-27,2024-03-28,0.0026991171626888624,-0.0033384268334509114,0.006037543996139774,1
2024-03-28,9568.SR,"Mayar Holding Co.'s 2023 financial results reflect substantial decreases in sales, gross profit, and net income. The company's accumulated losses and extraordinary expenses have raised concerns among investors. However, the Board's strategic plans to improve profitability and cash flows, modernize production, and reduce costs may help reverse the negative trend in the medium and long term.",2024-03-28,2024-03-31,0.022556369412079506,-0.01307747264400285,0.03563384205608236,1
2024-03-28,2100.SR," The positive financial results demonstrate Wafrah for Industry and Development Co.'s strong performance in 2023. The increased revenues, gross profit, and net profit indicate a healthy financial position, which may attract investor interest. However, the decrease in operational profit should be noted. The company's reliance on the vegetable and pasta sectors for growth may also present some risk if these sectors experience a downturn. Overall, the results suggest that the company is expanding its customer base and increasing sales power, contributing to its financial success.",2024-03-28,2024-03-31,-0.044534427023994134,-0.01307747264400285,-0.031456954379991284,0
2024-03-28,4141.SR,"Investors should be aware of the decrease in gross profit and net income, despite the growth in sales. However, the increase in total shareholders' equity could be seen as a positive sign. It is essential to consider the reasons behind the decline in profits and the potential for recovery in future periods.",2024-03-28,2024-03-31,-0.03823174510055214,-0.01307747264400285,-0.02515427245654929,0
2024-03-28,4021.SR,"The lease agreement does not have a direct financial impact on the company. The Chairman, Mr. Khalid bin Mohammed Al Ammar, holds an indirect interest in this contract as the Chairman of Khayrat Amariya Real Estate Company. The contract will be disclosed to the next General Assembly.",2024-03-28,2024-03-31,0.007194272245620405,-0.01307747264400285,0.020271744889623255,1
2024-03-28,1302.SR,"The awarded contracts signify a positive growth opportunity for Bawan Company's electric sector subsidiary, as they secure a substantial revenue stream for the 2024-2025 period. Investors can expect to see the infl uence of these contracts in Bawan's Q4 2024 to Q4 2025 financial statements.",2024-03-28,2024-03-31,-0.0073840142943301205,-0.01307747264400285,0.00569345834967273,1
2024-03-28,9535.SR," Ladun Investment Co.'s robust financial performance indicates a positive outlook for the company and its shareholders. The substantial growth in sales, profits, and shareholder equity highlights the success of their real estate projects and overall business strategy. Investors may consider these positive results as a reason to maintain or increase their exposure to Ladun Investment Co.",2024-03-28,2024-03-31,-0.09572648750576586,-0.01307747264400285,-0.08264901486176301,0
2024-04-02,4020.SR,"This contract marks a significant milestone for Al-Akaria, as it continues to expand its infrastructure projects portfolio. The 722 million Saudi Riyals contract will contribute to Al-Akaria's financial statements starting from Q1 2024, showcasing the company's strong financial performance and commitment to delivering high-value projects. The involvement of the Public Investment Fund further highlights the importance of this project for Saudi Arabia's infrastructure development.",2024-04-02,2024-04-03,0.024201355454638616,0.011672250561755188,0.012529104892883428,1
2024-04-02,9535.SR, The successful acquisition of this project by Ladun Investment Co.'s subsidiary indicates a strong presence in the construction sector and contributes to the company's financial growth in the coming years.,2024-04-02,2024-04-03,0.0,0.011672250561755188,-0.011672250561755188,0
2024-04-02,4020.SR,"This contract marks a significant milestone for Al-Akaria, as it continues to develop the Tilal Al Riyadh project. By engaging its subsidiary, Tamear, Al-Akaria ensures continuity and control over the project's execution. The 22-month contract duration allows for steady progress, while the financial impact will become evident in Q2 2024, contributing to Al-Akaria's financial performance.",2024-04-02,2024-04-03,0.024201355454638616,0.011672250561755188,0.012529104892883428,1
2024-04-02,4007.SR,"Al Hammadi Holding's sale of its land in Riyadh City marks a strategic move to support the company's future expansion plans. The transaction is anticipated to yield a capital gain of 55,269,000 SAR, improving the company's financial standing and contributing to its growth initiatives.",2024-04-02,2024-04-03,-0.01573429220060479,0.011672250561755188,-0.02740654276235998,0
2024-04-02,2120.SR,"The delayed release of the 2023 annual financial results is not expected to have a direct financial impact on the company or its stakeholders. However, the extension may cause temporary uncertainties in the market. Once the financial results are released, investors and stakeholders will gain clarity on the company's performance, enabling them to make informed decisions.",2024-04-02,2024-04-03,0.030266344384779376,0.011672250561755188,0.01859409382302419,1
2024-04-02,1140.SR,"Shareholders' participation in the Extraordinary General Assembly Meeting is crucial for decision-making regarding the Bank's financial performance, capital structure, dividends, and governance. By attending the meeting, shareholders can exercise their voting rights, engage in discussions, and contribute to shaping the Bank's future direction.",2024-04-02,2024-04-03,0.006315813693313873,0.011672250561755188,-0.0053564368684413145,0
2024-04-02,3020.SR,"These appointments and committee formations are expected to strengthen Yamama Cement Company's corporate governance, ensuring compliance with regulatory requirements and enhancing transparency. The new leadership and committee members bring diverse expertise and experience to their roles, which should contribute to the company's strategic decision-making and overall performance.",2024-04-02,2024-04-03,-0.008645510964396122,0.011672250561755188,-0.02031776152615131,0
2024-04-03,4280.SR, The approved amendments to the bylaws and the increase in board members aim to ensure compliance with the new Companies Law and enhance the company's governance structure. These changes will contribute to improved decision-making processes and better alignment with industry best practices.,2024-04-03,2024-04-04,0.0054495859702297705,0.006591566072757514,-0.0011419801025277431,0
2024-04-03,8311.SR,The renewal of the health insurance license ensures that Saudi Enaya Cooperative Insurance Co. can maintain its operations and continue providing health insurance services to its clients. This move demonstrates the company's commitment to adhering to regulatory requirements and its dedication to offering reliable health insurance solutions in the Saudi market.,2024-04-03,2024-04-04,-0.01726117672880914,0.006591566072757514,-0.023852742801566656,0
2024-04-04,9587.SR,"This contract win marks a significant milestone for Lana Company, as they expand their presence in the environmental management sector. The Ministry of Interior's decision to partner with Lana Company demonstrates trust in their capabilities to handle hazardous medical waste. This project will not only contribute to the cleanliness and safety of health centers affiliated with the Security Forces Hospital but also generate financial returns for Lana Company.",2024-04-04,2024-04-14,-0.02875015825036961,-0.0030317401146010676,-0.025718418135768542,0
2024-04-04,9530.SR," The ongoing discussions between Arabian Drilling and Aramco may result in temporary disruptions to the former's offshore operations. However, the company's revenue guidance for 2024 remains unchanged, and it continues to expect yearly growth. The addition of Unconventional Gas land rigs in Q3 2024 should further contribute to this growth, potentially offsetting the impact of the offshore contract suspensions.",2024-04-04,2024-04-15,-0.014184361346167912,0.00022981703028742502,-0.014414178376455337,0
2024-04-04,7010.SR,"stc shareholders are encouraged to participate in the Ordinary General Assembly meeting using the Tadawulaty Platform. This virtual format enables shareholders to engage in discussions, ask questions, and exercise their voting rights electronically, promoting accessibility and convenience.",2024-04-04,2024-04-14,0.0,-0.0030317401146010676,0.0030317401146010676,1
2024-04-04,3005.SR," This extension allows Umm Al-Qura Cement Co. and City Cement Co. more time to evaluate the potential securities exchange deal. The decision to extend the MoU indicates a commitment to thoroughly assessing the deal's implications, ensuring a more informed final decision. Investors should monitor for further updates regarding the progress of the negotiations and the outcome of the evaluations.",2024-04-04,2024-04-15,0.007370941451077506,0.00022981703028742502,0.007141124420790081,1
2024-04-04,2382.SR," The temporary suspension of five offshore jack-ups in Saudi Arabia allows ADES to capitalize on higher daily rates in new contracts in Thailand and the region. The company's strong financial guidance and robust marketing strategy for the remaining rigs position ADES well to benefit from the tight market conditions and elevated utilization rates, reinforcing its standing as a leading player in the global offshore jack-up market.",2024-04-04,2024-04-14,0.05402545037625181,-0.0030317401146010676,0.05705719049085288,1
2024-04-04,2100.SR,"The addition of Mr. Majid Misfer Al-Ghufaili to Wafrah for Industry and Development Co.'s Board of Directors is expected to contribute valuable expertise and insights from his extensive background in Saudi industrial companies. However, his appointment is provisional and awaits approval from the first General Assembly of shareholders.",2024-04-04,2024-04-15,0.02127659574468085,0.00022981703028742502,0.021046778714393425,1
2024-04-04,2020.SR," The meeting offers shareholders an opportunity to participate in discussions, ask questions, and vote on the General Assembly Meetings agenda remotely. The electronic voting process ensures convenience and accessibility for shareholders, while the live audio broadcast allows those unable to attend to stay informed.",2024-04-04,2024-04-15,-0.022988530226620573,0.00022981703028742502,-0.023218347256908,0
