Date,ticker,Impact,t0,t1,r_stock_1d,r_index_1d,ar_1d,label
2024-03-03,1302.SR,"Shareholders who meet the eligibility criteria can expect to receive cash dividends from Bawan Co. for the second half of 2023. To facilitate seamless dividend disbursement, stakeholders are advised to update their personal information and link their bank accounts to their investment portfolios.",2024-03-03,2024-03-04,0.022494855619563763,-0.009606406085625782,0.032101261705189545,1
2024-03-03,2020.SR, The extension of the MoU between SABIC Agri-Nutrients Company and SALIC demonstrates both parties' commitment to further exploring opportunities for food security and environmental sustainability. This extension does not have any material financial impact on the company.,2024-03-03,2024-03-04,-0.009584640395305022,-0.009606406085625782,2.1765690320760603e-05,1
2024-03-03,4100.SR," The establishment of the Investment Committee by Makkah Construction and Development Company demonstrates a commitment to strategic planning and decision-making in regards to investments. The committee's formation is expected to enhance the company's ability to evaluate potential investment opportunities and make informed decisions, contributing to the overall growth and success of the organization.",2024-03-03,2024-03-04,-0.004597638768507478,-0.009606406085625782,0.005008767317118304,1
2024-03-03,9523.SR,The addition of a new audit committee member to Group Five Pipe Saudi Co. demonstrates the company's commitment to maintaining strong corporate governance practices. This appointment will contribute to the oversight of the company's financial reporting and internal control processes.,2024-03-03,2024-03-04,-0.041379292805989586,-0.009606406085625782,-0.031772886720363804,0
2024-03-03,9523.SR,"The announcement impacts shareholders and stakeholders of Group Five Pipe Saudi Co., who should refer to the Arabic version for specific meeting details. The high attendance rate indicates strong shareholder engagement, potentially influencing future company decisions.",2024-03-03,2024-03-04,-0.041379292805989586,-0.009606406085625782,-0.031772886720363804,0
2024-03-04,8260.SR, The approval of the Domestic Workers Contract Insurance product allows Gulf General Cooperative Insurance Company to extend its product offerings in the Kingdom of Saudi Arabia. This move is expected to bolster the company's presence in the region and cater to the needs of individuals employing domestic workers.,2024-03-04,2024-03-05,0.0,0.0028598085921486024,-0.0028598085921486024,0
2024-03-04,8200.SR,The sale of Saudi Re's stake in Probitas Holdings (Bermuda) Limited will have a positive impact on the company's financials in 2024. The transaction proceeds will enable Saudi Re to strengthen its financial position and capitalize on growth opportunities in its core markets.,2024-03-04,2024-03-05,0.0,0.0028598085921486024,-0.0028598085921486024,0
2024-03-04,4263.SR,"The positive financial results highlight SAL's success in increasing revenues and controlling costs. The growth in net profit and total comprehensive income demonstrates the company's financial strength. Investors may view these results favorably, potentially leading to increased interest in the company's shares.",2024-03-04,2024-03-05,-0.005423749503442796,0.0028598085921486024,-0.0082835580955914,0
2024-03-04,4263.SR,"The declaration of cash dividends by SAL Saudi Logistics Services Co. signifies a positive outcome for its shareholders, providing them with a 15.1% return on share par value. This move is expected to strengthen investor confidence and contribute to the company's reputation as a profitable investment.",2024-03-04,2024-03-05,-0.005423749503442796,0.0028598085921486024,-0.0082835580955914,0
2024-03-04,1120.SR,"The decision by Al Rajhi Bank to issue U.S. Dollar-denominated sustainable Sukuk reflects its commitment to sustainable finance and its strategic objectives. The offering, once approved, will provide eligible investors with the opportunity to participate in a Shariah-compliant investment instrument, potentially attracting a diverse range of investors and contributing to the growth of the global Sukuk market.",2024-03-04,2024-03-05,0.0,0.0028598085921486024,-0.0028598085921486024,0
2024-03-04,4071.SR," The amended contract between Al Arabia and Remat Al-Riyadh Development Company signifies a strategic shift in their partnership, with Al Arabia transferring a portion of the investment returns as owned shares to Remat Al-Riyadh Development Company. This adjustment may impact Al Arabia's financials and shareholding structure, while simultaneously fostering stronger ties between the two companies and contributing to the Kingdom's economic growth in line with Vision 2030.",2024-03-04,2024-03-05,0.0,0.0028598085921486024,-0.0028598085921486024,0
2024-03-05,4330.SR,This earnings conference call allows Riyadh Cables Group Co. to strengthen its relationship with the financial community by providing transparent and detailed information about its 2023 financial performance. It offers an opportunity for investors and analysts to gain insights into the company's operations and ask questions directly to the management.,2024-03-05,2024-03-06,0.010285731724330357,0.007357569646391532,0.0029281620779388253,1
2024-03-05,2222.SR," The decision to sell off Turkish investments indicates Saudi Cable Company's strategic shift to focus on more profitable opportunities. This move may lead to improved financial performance for the company in the long run, but could also result in short-term financial implications due to potential divestment costs.",2024-03-05,2024-03-06,0.01602564063376303,0.007357569646391532,0.008668070987371497,1
2024-03-05,1140.SR,"Bank Albilad's capital increase is expected to strengthen its financial position and enable the bank to pursue new business opportunities. Shareholders will benefit from the distribution of bonus shares, which could potentially lower the share price and attract more investors, contributing to increased trading volume and liquidity.",2024-03-05,2024-03-06,0.0,0.007357569646391532,-0.007357569646391532,0
2024-03-05,1140.SR,"Bank Albilad's capital increase, authorized by the Capital Market Authority, will result in a stronger financial position for the bank. The distribution of bonus shares to existing shareholders will dilute their equity but potentially attract new investors, contributing to the growth of the bank's outstanding shares. Shareholders must remain vigilant to ensure compliance with the bank's due dates and regulatory requirements.",2024-03-05,2024-03-06,0.0,0.007357569646391532,-0.007357569646391532,0
2024-03-05,1120.SR,"This announcement signifies Al Rajhi Bank's entry into the international Sukuk market, aiming to raise capital through its sustainable Sukuk offering. The move is expected to attract eligible investors seeking Shariah-compliant investments and contribute to the growth of sustainable finance.",2024-03-05,2024-03-06,0.0,0.007357569646391532,-0.007357569646391532,0
2024-03-05,2200.SR,"The impressive financial performance of Arabian Pipes Co. in 2023 reflects the company's successful execution of its business strategies and operational efficiency. The substantial growth in sales, profits, and shareholders' equity is expected to attract investor interest and potentially lead to an increased market capitalization.",2024-03-05,2024-03-06,0.013100424405900453,0.007357569646391532,0.005742854759508921,1
2024-03-06,4162.SR,"This acquisition marks a significant milestone for Almunajem Foods Co., expanding their portfolio and strengthening their presence in the poultry sector. The transaction, valued at SAR 134 million, highlights the company's commitment to strategic investments and growth.",2024-03-06,2024-03-07,0.011605386175374986,0.0012720600936642966,0.010333326081710689,1
2024-03-06,6070.SR,"The declaration of dividends by Al-Jouf Agricultural Development Co. will result in shareholders receiving a 5% return on their investment, based on the par value of their shares. This move is anticipated to positively impact shareholders and potentially attract new investors, contributing to the company's market standing.",2024-03-06,2024-03-07,0.022346382605037546,0.0012720600936642966,0.02107432251137325,1
2024-03-06,4021.SR,"The new headquarters in Jubail city will enable Canadian Medical Center Co. to strengthen its presence in the region and cater to the needs of the local population by offering home healthcare services. The contract represents a strategic move to enhance the company's operations and expand its footprint, ultimately contributing to its financial performance in the latter half of 2024.",2024-03-06,2024-03-07,0.001412461721694663,0.0012720600936642966,0.0001404016280303665,1
2024-03-06,1120.SR,The successful completion of Al Rajhi Bank's U.S. dollar-denominated sustainable Sukuk offering demonstrates the bank's commitment to sustainable finance and its ability to tap into the international Islamic capital market. This move is expected to attract a diverse range of global investors and further strengthen Al Rajhi Bank's position in the industry.,2024-03-06,2024-03-07,-0.0069444266611659675,0.0012720600936642966,-0.008216486754830265,0
2024-03-06,2222.SR," The reported financial results reflect a challenging year for Saudi Electricity Company, with a substantial decline in net profit despite an increase in sales/revenue. Investors should closely monitor the company's efforts to address rising costs and maintain profitability. The company's forthcoming conference call with investors and financial analysts will provide further insight into the financial performance and strategies moving forward.",2024-03-06,2024-03-07,0.0015772629607946605,0.0012720600936642966,0.0003052028671303639,1
2024-03-06,2222.SR,"Shareholders of Saudi Electricity Company can expect cash dividends for fiscal year 2023, subject to certain tax implications for non-resident foreign investors. Shareholders should ensure their banking information is up-to-date to facilitate dividend payments.",2024-03-06,2024-03-07,0.0015772629607946605,0.0012720600936642966,0.0003052028671303639,1
2024-03-06,1182.SR,"The proposed capital increase by Amlak Finance is expected to strengthen the company's financial position and support its expansion plans. Shareholders will benefit from the bonus issue, receiving one additional share for every eight shares owned. The success of the capital increase relies on the approval of regulatory authorities and the extraordinary general assembly. Upon approval, the transaction is likely to positively impact Amlak Finance's market presence and investor confidence.",2024-03-06,2024-03-07,0.03102964223263614,0.0012720600936642966,0.029757582138971842,1
2024-03-06,2370.SR," The positive financial performance of Middle East Specialized Cables Co. indicates a healthy financial position, with improvements in sales, profits, and equity. Investors may find these results encouraging, potentially attracting increased interest in the company's shares. However, the reclassification of some comparative figures from the previous year may require careful analysis when comparing performance.",2024-03-06,2024-03-07,-0.03861003917870892,0.0012720600936642966,-0.03988209927237322,0
2024-03-07,4330.SR,"Shareholders registered with Edaa by the specified date will receive a dividend of SAR 1.50 per share, making the total dividends for the year 2023 SAR 2.50 per share. This announcement is likely to positively impact shareholders and influence the company's stock price.",2024-03-07,2024-03-10,-0.0011299693164730906,0.0032390382762893903,-0.004369007592762481,0
2024-03-07,4190.SR,"The announcement of dividend distribution by Jarir Marketing Co. will likely positively impact its investors, who will receive a 23% return on share par value. To benefit from this dividend, shareholders must ensure they meet the eligibility criteria set by the company.",2024-03-07,2024-03-10,0.010471194385354708,0.0032390382762893903,0.0072321561090653175,1
2024-03-07,3020.SR,"The launch of the new Yamama Cement Factory demonstrates the company's commitment to enhancing its capabilities in the cement sector and realizing its vision of becoming a leader in the industry, both locally and internationally. The factory's significant production capacity and advanced technology are expected to contribute to the local economy, in line with the Kingdom's Vision 2030, while providing high-quality cement products to the market.",2024-03-07,2024-03-10,0.0068119889592061274,0.0032390382762893903,0.003572950682916737,1
2024-03-07,2223.SR,"The transfer of shares to PIF's fully owned companies does not impact Saudi Aramco's operations, strategy, dividends distribution policy, or governance framework. The State remains the largest shareholder, ensuring business continuity and maintaining the Company's strategic direction.",2024-03-07,2024-03-10,0.0256111398039894,0.0032390382762893903,0.02237210152770001,1
2024-03-07,1213.SR, The call for nominations allows eligible individuals to participate in the governance of Naseej International Trading Co. as Board members. Successful candidates will contribute to shaping the company's strategic direction and overseeing its operations. This process supports the company's commitment to maintaining sound corporate governance practices and ensures shareholder representation in decision-making.,2024-03-07,2024-03-10,-0.014765080189544883,0.0032390382762893903,-0.018004118465834273,0
2024-03-10,9587.SR,The launch of Lana Medical Company's high-risk medical waste treatment plant in Hail signifies a significant expansion in the company's capacity to manage medical waste in the region. This development will contribute to improved health and environmental standards in the Hail region and the north of the Kingdom. Investors can anticipate positive financial impacts from the second quarter of 2024 onwards.,2024-03-10,2024-03-11,-0.043038211230259055,-0.004984728127231993,-0.03805348310302706,0
2024-03-10,8060.SR,"The submission of the rights issue application to the CMA indicates that Walaa Cooperative Insurance Co. is moving forward with its plans to raise additional capital. This move could potentially strengthen the company's financial position and enable it to pursue new business opportunities. However, the success of the rights issue will depend on the market's response and the overall economic conditions.",2024-03-10,2024-03-11,0.01908396890992699,-0.004984728127231993,0.024068697037158984,1
2024-03-10,4150.SR,"ARDCO's decision to distribute cash dividends and special dividends is a positive development for shareholders, who will benefit from a 5% return on share par value. The additional special dividend highlights the company's focus on rewarding shareholders while maintaining sustainable growth.",2024-03-10,2024-03-11,0.017441863688731473,-0.004984728127231993,0.022426591815963466,1
2024-03-10,2223.SR," The 2023 financial results of Saudi Aramco indicate a challenging year for the company due to lower crude oil prices and reduced sales volumes. Despite the decline, Saudi Aramco managed to maintain a significant operational profit and net profit, demonstrating resilience in the face of market challenges. Investors should closely monitor the company's performance and strategies to adapt to evolving market conditions.",2024-03-10,2024-03-11,-0.015891050512221623,-0.004984728127231993,-0.01090632238498963,0
2024-03-10,2223.SR,"Saudi Aramco's decision to increase the Q4 2023 base dividend and distribute performance-linked dividends based on the combined 2022-2023 full-year results demonstrates the company's commitment to delivering value to its shareholders. The total distribution of SAR 116.50 billion ($31.07 billion) among 241,957,485,588 shares will positively impact shareholders, offering them a return on their investment.",2024-03-10,2024-03-11,-0.015891050512221623,-0.004984728127231993,-0.01090632238498963,0
2024-03-10,2223.SR,"The approval of the third distribution of performance-linked dividends by Saudi Aramco's Board of Directors demonstrates the company's commitment to rewarding shareholders. The substantial dividend amount highlights the company's strong financial performance and cash flow generation capabilities. Investors may benefit from the distribution, which could potentially boost their returns and confidence in the company.",2024-03-10,2024-03-11,-0.015891050512221623,-0.004984728127231993,-0.01090632238498963,0
2024-03-10,6070.SR,"The election of the new board members will bring fresh perspectives and ideas to Al-Jouf Agricultural Development Co., potentially leading to improved corporate performance and better alignment with the company's long-term objectives. Shareholders and stakeholders should anticipate updates regarding the new board's strategic direction and initiatives in the coming months.",2024-03-10,2024-03-11,-0.00909090909090909,-0.004984728127231993,-0.004106180963677097,0
2024-03-11,9530.SR,"The appointment of these three new Board Members brings diverse expertise and experience to Arabian Shield Cooperative Insurance Co. Once approved by the relevant authorities, they will contribute to the decision-making process and help guide the company's strategic direction.",2024-03-11,2024-03-12,0.0011918769046774008,0.004636986520321097,-0.003445109615643696,0
2024-03-11,9530.SR,The publication of Arabian Drilling's Q4'23 and FY2023 financial results and the subsequent earnings call will provide transparency into the company's performance and create an opportunity for investors and analysts to gain insights directly from the management team.,2024-03-11,2024-03-12,0.0011918769046774008,0.004636986520321097,-0.003445109615643696,0
2024-03-11,2283.SR,"The positive financial results of First Milling Co. indicate a strong performance in 2023, with increased sales/revenue and net profit compared to the previous year. The growth in sales was primarily driven by the flour, feed, and bran segments, while net profit benefited from higher value and volume sales, cost control measures, and reduced general and administrative expenses. These results suggest a favorable outlook for the company and potential opportunities for investors.",2024-03-11,2024-03-12,0.02400960296192685,0.004636986520321097,0.01937261644160575,1
2024-03-11,2160.SR,"The announcement indicates a strong demand for Amiantit's shares, with 91.71% coverage of the new offering. The remaining shares will be available for institutional investors to purchase, potentially increasing their exposure to the company. This may positively affect the company's market capitalization and share price.",2024-03-11,2024-03-12,-0.024561430278577302,0.004636986520321097,-0.0291984167988984,0
2024-03-11,1303.SR," The robust financial performance of Electrical Industries Co. indicates a positive trend for the company, potentially attracting more investors and contributing to the growth of the Saudi Arabian market. The improved financials may lead to increased confidence in the company's ability to manage its operations and expand its market presence.",2024-03-11,2024-03-12,-0.05532786364646356,0.004636986520321097,-0.059964850166784656,0
2024-03-11,1080.SR," The CMA's approval of Arab National Bank's capital increase will bolster the bank's financial position and enable it to pursue growth opportunities. Shareholders will benefit from the distribution of bonus shares, while potential investors may view the bank as a more attractive investment opportunity due to its stronger capital base.",2024-03-11,2024-03-12,-0.008591064991777208,0.004636986520321097,-0.013228051512098306,0
2024-03-11,1080.SR,"The CMA's approval of Arab National Bank's capital increase will result in a stronger financial position for the bank, enabling it to pursue new business opportunities and investments. Existing shareholders will benefit from the increased capital through the distribution of bonus shares, potentially enhancing their holdings and portfolio value.",2024-03-11,2024-03-12,-0.008591064991777208,0.004636986520321097,-0.013228051512098306,0
2024-03-11,2283.SR, The distribution of cash dividends for the second half of 2023 will provide shareholders with a return on their investment. Non-resident foreign investors should be mindful of the potential 5% withholding tax. Shareholders are advised to ensure their data and bank account information are up-to-date to guarantee seamless dividend disbursement.,2024-03-11,2024-03-12,0.02400960296192685,0.004636986520321097,0.01937261644160575,1
2024-03-12,1201.SR," The successful completion of Takween Advanced Industries Co.'s rump offering and rights issue allotment demonstrates strong investor confidence in the company. The oversubscription indicates a positive market response, while the distribution of excess proceeds will benefit eligible shareholders. The company's receipt of the offer price will support its financial position and future operations.",2024-03-12,2024-03-13,-0.031019208085467813,0.008657878285239815,-0.03967708637070763,0
2024-03-12,1303.SR," Shareholders of Electrical Industries Co. can expect to receive cash dividends for the second half of 2023, provided they meet the eligibility criteria. Foreign investors need to consider potential tax implications. This dividend distribution demonstrates the company's commitment to rewarding its shareholders and enhancing their investment returns.",2024-03-12,2024-03-13,0.0412147617608882,0.008657878285239815,0.03255688347564839,1
2024-03-12,2283.SR,"This virtual earnings conference call allows First Milling Company to share its 2023 financial results directly with financial analysts and investors, fostering transparency and engagement with the investment community.",2024-03-12,2024-03-13,0.029308322515335262,0.008657878285239815,0.020650444230095447,1
2024-03-12,4081.SR," Investors should be aware of the decline in net profit despite an increase in sales/revenue. Higher finance costs and impairment charges impacted the bottom line. Nevertheless, the increase in total comprehensive income and shareholders' equity may be seen as positive indicators for the company's financial health.",2024-03-12,2024-03-13,-0.0027972000922729906,0.008657878285239815,-0.011455078377512806,0
2024-03-12,9566.SR,"The renewed credit facilities agreement demonstrates Saudi Lime Industries Company's strong relationship with Arab National Bank and its commitment to Sharia compliance. This financing will enable the company to pursue strategic growth initiatives, ultimately contributing to its long-term success and financial stability.",2024-03-12,2024-03-13,-0.0030675037426141204,0.008657878285239815,-0.011725382027853936,0
2024-03-13,9568.SR,The successful acquisition of this sizeable contract by Mayar Holding Company's subsidiary will generate substantial revenue over the 24-month implementation period. This development is likely to bolster the company's financial standing and solidify its position in the market.,2024-03-13,2024-03-14,-0.034313693407726165,0.00042284203576373224,-0.034736535443489897,0
2024-03-13,8060.SR,"Walaa Cooperative Insurance Co.'s strong financial performance in 2023 highlights the company's successful growth strategy and improved operational efficiency. The increased net profit and revenue will likely boost investor confidence and contribute to the company's market standing. However, the rise in operating expenses requires careful monitoring to ensure sustainable growth.",2024-03-13,2024-03-14,0.028777020372816688,0.00042284203576373224,0.028354178337052956,1
2024-03-13,4082.SR," The financial results show a positive trend in revenue growth, but declines in profitability metrics. Despite the increase in sales, the decrease in net profit and comprehensive income may raise concerns for some investors. However, the substantial rise in total shareholders' equity could be viewed as a positive sign. Overall, the unmodified auditor's opinion supports the credibility of the financial statements.",2024-03-13,2024-03-14,-0.0475409780962112,0.00042284203576373224,-0.047963820131974935,0
2024-03-13,2110.SR,"Shareholders of Saudi Cable Company are encouraged to participate in the Ordinary General Assembly meeting to exercise their voting rights on the election of board members and the policy of nominating board members and executive management. The meeting offers shareholders the convenience of attending in-person or via modern technology, providing an opportunity for remote participation and voting.",2024-03-13,2024-03-14,0.0,0.00042284203576373224,-0.00042284203576373224,0
2024-03-13,9557.SR,The contract between EDARAT and NCM will contribute positively to EDARAT's financial performance in 2024 and 2025. The company will benefit from the revenue generated by providing and supporting the Meteomatics weather analysis system for the National Center For Meteorology.,2024-03-13,2024-03-14,-0.021153073307372507,0.00042284203576373224,-0.02157591534313624,0
2024-03-14,8170.SR,"Al-Etihad Cooperative Insurance Co.'s strong financial performance in 2023 reflects an improved insurance business and investment strategy. The growth in revenues and net profit will likely boost investor confidence and contribute to the company's market reputation. The adoption of IFRS 17 and IFRS 9 has resulted in a significant change in the presentation of financial results, providing a more accurate representation of the company's financial health.",2024-03-14,2024-03-17,0.0008368037590108034,0.0026632622411436537,-0.0018264584821328501,0
